,created_date,week,sentiment.compound,id,text-encoded
871,2017-03-15 10:55:30,11,-0.628,841966077005463553,"Does anybody really believe that a reporter, who nobody ever heard of, ""went to his mailbox"" and found my tax returns? @NBCNews  FAKE NEWS!"
872,2017-03-17 09:35:58,11,-0.7263,842670836905639936,"RT @DiamondandSilk: When the President says ""You're Fired""     That means: ""Pack Yo Stuff and Go, Not Say ""You Refuse to Go!  #DrainTheSwam..."
873,2017-03-13 13:11:17,11,-0.7424,841275470796738560,"ObamaCare is imploding. It is a disaster and 2017 will be the worst year yet, by far! Republicans will come together and save the day."
874,2017-03-15 11:02:40,11,-0.9168,841967881516679168,"Can you imagine what the outcry would be if @SnoopDogg, failing career and all, had aimed and fired the gun at President Obama? Jail time!"
875,2017-03-05 17:30:11,10,0.9286,838441522546769923,Thank you for the great rallies all across the country. Tremendous support. Make America Great Again!
876,2017-03-09 17:01:17,10,0.8516,839883804315684864,"Despite what you hear in the press, healthcare is coming along great. We are talking to many groups and it will end in a beautiful picture!"
877,2017-03-08 00:14:30,10,0.8398,839268048313929729,I feel sure that my friend @RandPaul will come along with the new and great health care program because he knows Obamacare is a disaster!
878,2017-03-07 14:14:03,10,0.8171,839116941956640768,"Don't let the FAKE NEWS tell you that there is big infighting in the Trump Admin. We are getting along great, and getting major things done!"
879,2017-03-10 13:45:02,10,0.7034,840196801009451009,"RT @DRUDGE_REPORT: GREAT AGAIN:  +235,000 https://t.co/GkockGNdtC"
880,2017-03-06 23:49:53,10,0.6696,838899465390018560,There is an incredible spirit of optimism sweeping the country right nowwe're bringing back the JOBS! https://t.co/BNSLvKiEVj
881,2017-03-08 23:54:16,10,0.6588,839625347524096000,"Great news. We are only just beginning. Together, we are going to #MAGA! https://t.co/BSp685Q9Qf https://t.co/K7yeBZsf6r"
882,2017-03-08 23:50:25,10,0.6588,839624377826230272,Met with @RepCummings today at the @WhiteHouse. Great discussion!
883,2017-03-08 11:12:39,10,0.6486,839433678275153921,I have tremendous respect for women and the many roles they serve that are vital to the fabric of our society and our economy.
884,2017-03-11 14:39:07,10,0.6239,840572799202783233,We are making great progress with healthcare. ObamaCare is imploding and will only get worse. Republicans coming together to get job done!
885,2017-03-07 13:41:58,10,0.6131,839108868584124417,"Don't worry, getting rid of state lines, which will promote competition, will be in phase 2 &amp; 3 of healthcare rollout. @foxandfriends"
886,2017-03-07 03:50:49,10,0.6114,838960097674002432,"Thank you to @exxonmobil for your $20 billion investment that is creating more than 45,000 manufacturing &amp; construction jobs in the USA!"
887,2017-03-09 23:11:27,10,0.5859,839976956703748096,Honored to meet this years @SenateYouth delegates w/ @VP Pence in the East Room of the @WhiteHouse. Congratulations... https://t.co/oQIx7LybCV
888,2017-03-06 21:22:15,10,0.5707,838862312685637640,"45,000 construction &amp; manufacturing jobs in the U.S. Gulf Coast region. $20 billion investment. We are already winning again, America!"
889,2017-03-09 13:13:54,10,0.5267,839826581354921984,RT @foxnation: .@realDonaldTrump's First Full Month in Office Sees Biggest Jobs Gain 'In Years': Report: https://t.co/rx4bgI1MWK
890,2017-03-08 11:13:44,10,0.4939,839433951957696513,"On International Women's Day, join me in honoring the critical role of women here in America &amp; around the world."
891,2017-03-09 22:36:27,10,0.4404,839968149890076672,'U.S. Consumer Comfort Just Reached Its Highest Level in a Decade' https://t.co/S8nZgmeMMV https://t.co/xC0piRa6eP
892,2017-03-08 12:11:25,10,0.4404,839448469374894080,LinkedIn Workforce Report: January and February were the strongest consecutive months for hiring since August and September 2015
893,2017-03-07 03:49:54,10,0.4199,838959869772328960,"Buy American &amp; hire American are the principles at the core of my agenda, which is: JOBS, JOBS, JOBS! Thank you @exxonmobil."
894,2017-03-06 21:21:32,10,0.4199,838862131852369922,"Buy American &amp; hire American are the principals at the core of my agenda, which is: JOBS, JOBS, JOBS! Thank you @exxonmobil."
895,2017-03-07 13:13:20,10,0.3802,839101660886614016,"For eight years Russia ""ran over"" President Obama, got stronger and stronger, picked-off Crimea and added missiles. Weak! @foxandfriends"
896,2017-03-10 15:40:53,10,0.0,840225958854561792,"Weekly Address - 11:00 A.M. at the @WhiteHouse! #MAGA
https://t.co/YSaPJnSX2i https://t.co/Gb8iTGzb6j"
897,2017-03-07 13:46:28,10,0.0,839110000870109184,I am working on a new system where there will be competition in the Drug Industry. Pricing for the American people will come way down!
898,2017-03-06 21:19:04,10,0.0,838861512999649286,"'President Trump Congratulates Exxon Mobil for Job-Creating Investment Program'
https://t.co/adBzWhtq8S"
899,2017-03-05 11:40:20,10,0.0,838353481526312961,"Who was it that secretly said to Russian President, ""Tell Vladimir that after the election I'll have more flexibility?"" @foxandfriends"
900,2017-03-07 12:13:59,10,-0.1759,839086723552411648,Our wonderful new Healthcare Bill is now out for review and negotiation. ObamaCare is a complete and total disaster - is imploding fast!
901,2017-03-05 11:32:22,10,-0.2325,838351476401520640,Is it true the DNC would not allow the FBI access to check server or other equipment after learning it was hacked? Can that be possible?
902,2017-03-10 13:32:05,10,-0.6249,840193545046773760,"RT @foxandfriends: ""Never give up....that's the worst thing you could do. There's always a chance."" -Kyle Coddington's message to those als..."
903,2017-03-07 12:04:13,10,-0.8955,839084268991229952,"122 vicious prisoners, released by the Obama Administration from Gitmo, have returned to the battlefield. Just another terrible decision!"
904,2017-02-27 17:06:23,9,0.8481,836261209540288513,Great meeting with CEOs of leading U.S. health insurance companies who provide great healthcare to the American peo... https://t.co/60jigi6ffS
905,2017-03-03 20:48:21,9,0.8316,837766616603586560,We must fix our education system for our kids to Make America Great Again. Wonderful day at Saint Andrew in Orlando. https://t.co/OTJaHcvLzf
906,2017-03-04 11:52:54,9,0.807,837994257566863360,"I'd bet a good lawyer could make a great case out of the fact that President Obama was tapping my phones in October, just prior to Election!"
907,2017-03-02 11:00:41,9,0.7734,837256338203881472,"Since November 8th, Election Day, the Stock Market has posted $3.2 trillion in GAINS and consumer confidence is at a 15 year high. Jobs!"
908,2017-03-03 02:22:49,9,0.7563,837488402438176769,"Jeff Sessions is an honest man. He did not say anything wrong. He could have stated his response more accurately, but it was clearly not...."
909,2017-03-03 22:13:10,9,0.729,837787963027144706,MAKE AMERICA GREAT AGAIN! https://t.co/kuQiZDz4rA
910,2017-02-28 02:43:03,9,0.5411,836406328369242113,I will be interviewed on @foxandfriends at 6:00 A.M. Enjoy!
911,2017-03-03 02:35:33,9,0.5267,837491607171629057,"...to win. The Democrats are overplaying their hand. They lost the election, and now they have lost their grip on reality. The real story..."
912,2017-02-27 21:48:21,9,0.4391,836332166728527872,"GOP now viewed more favorably than Dems, in Trump era (per NBC/WSJ poll) via @HotlineJosh:
https://t.co/Soebxtg2Zd"
913,2017-03-01 13:38:44,9,0.4199,836933725602656256,THANK YOU!
914,2017-03-03 16:41:55,9,0.296,837704599704375296,"Weekly Address
Join me here: https://t.co/SEavQK5zy5 https://t.co/EnyXYeqgcp"
915,2017-03-01 01:30:49,9,0.296,836750538943377408,"Join me live at 9:00 P.M. 
#JointAddress https://t.co/J882zbyVkJ https://t.co/gTtK3vJmkU"
916,2017-03-04 11:26:47,9,0.0,837987684660412416,The first meeting Jeff Sessions had with the Russian Amb was set up by the Obama Administration under education program for 100 Ambs......
917,2017-03-03 17:54:30,9,0.0,837722869106880517,We should start an immediate investigation into @SenSchumer and his ties to Russia and Putin. A total hypocrite! https://t.co/Ik3yqjHzsA
918,2017-03-03 12:00:39,9,0.0,837633820417482754,"Nick Adams new book, Green Card Warrior, is a must read. The merit-based system is the way to go. Canada, Australia! @foxandfriends"
919,2017-03-01 01:42:16,9,0.0,836753422271582208,"#JointSession #MAGA
https://t.co/RDO6Jt2pip"
920,2017-02-26 20:13:52,9,0.0,835946001873657858,"Big dinner with Governors tonight at White House. Much to be discussed, including healthcare."
921,2017-02-26 11:33:16,9,-0.1109,835814988686233601,"The race for DNC Chairman was, of course, totally ""rigged."" Bernie's guy, like Bernie himself, never had a chance. Clinton demanded Perez!"
922,2017-03-04 13:19:29,9,-0.1144,838016045222854656,"Arnold Schwarzenegger isn't voluntarily leaving the Apprentice, he was fired by his bad (pathetic) ratings, not by me. Sad end to great show"
923,2017-03-04 11:42:59,9,-0.25,837991759045079040,"Just out: The same Russian Ambassador that met Jeff Sessions visited the Obama White House 22 times, and 4 times last year alone."
924,2017-03-03 02:27:29,9,-0.3818,837489578193846278,...intentional. This whole narrative is a way of saving face for Democrats losing an election that everyone thought they were supposed.....
925,2017-03-04 11:49:00,9,-0.3869,837993273679560704,"Is it legal for a sitting President to be ""wire tapping"" a race for president prior to an election? Turned down by court earlier. A NEW LOW!"
926,2017-03-04 11:35:20,9,-0.5696,837989835818287106,"Terrible! Just found out that Obama had my ""wires tapped"" in Trump Tower just before the victory. Nothing found. This is McCarthyism!"
927,2017-03-03 21:02:23,9,-0.5994,837770149767827456,"I hereby demand a second investigation, after Schumer, of Pelosi for her close ties to Russia, and lying about it. https://t.co/qCDljfF3wN"
928,2017-03-03 20:49:53,9,-0.5994,837767004236955649,"I hearby demand a second investigation, after Schumer, of Pelosi for her close ties to Russia, and lying about it. https://t.co/qCDljfF3wN"
929,2017-03-03 20:47:30,9,-0.5994,837766402937393155,"I hear by demand a second investigation, after Schumer, of Pelosi for her close ties to Russia, and lying about it. https://t.co/qCDljfF3wN"
930,2017-02-26 11:42:39,9,-0.6696,835817351178301440,For first time the failing @nytimes will take an ad (a bad one) to help save its failing reputation. Try reporting accurately &amp; fairly!
931,2017-03-04 12:02:48,9,-0.7088,837996746236182529,How low has President Obama gone to tapp my phones during the very sacred election process. This is Nixon/Watergate. Bad (or sick) guy!
932,2017-03-03 02:38:48,9,-0.75,837492425283219458,"...is all of the illegal leaks of classified and other information. It is a total ""witch hunt!"""
933,2017-03-03 12:19:12,9,-0.7949,837638488656920576,It is so pathetic that the Dems have still not approved my full Cabinet.
934,2017-02-26 18:16:41,9,-0.8528,835916511944523777,"Russia talk is FAKE NEWS put out by the Dems, and played up by the media, in order to mask the big election defeat and the illegal leaks!"
935,2017-02-22 12:50:56,8,0.9148,834384982495940613,Very much enjoyed my tour of the Smithsonian's National Museum of African American History and Culture...A great job done by amazing people!
936,2017-02-25 21:53:21,8,0.8883,835608648625836032,I will not be attending the White House Correspondents' Association Dinner this year. Please wish everyone well and have a great evening!
937,2017-02-20 14:33:33,8,0.8439,833686030679207936,HAPPY PRESIDENTS DAY - MAKE AMERICA GREAT AGAIN!
938,2017-02-25 13:27:04,8,0.8221,835481237879926784,"Great optimism for future of U.S. business, AND JOBS, with the DOW having an 11th straight record close. Big tax &amp; regulation cuts coming!"
939,2017-02-21 00:38:40,8,0.743,833838311315763200,"Congratulations to our new National Security Advisor, General H.R. McMaster. Video: https://t.co/BKn9r225Kk https://t.co/VBXcJ1b6Pv"
940,2017-02-25 12:25:24,8,0.729,835465719970217984,Maybe the millions of people who voted to MAKE AMERICA GREAT AGAIN should have their own rally. It would be the biggest of them all!
941,2017-02-25 22:02:22,8,0.6269,835610917568200705,"Congratulations to Thomas Perez, who has just been named Chairman of the DNC. I could not be happier for him, or for the Republican Party!"
942,2017-02-20 19:33:35,8,0.5081,833761537525444608,Meeting with Generals at Mar-a-Lago in Florida. Very interesting!
943,2017-02-22 12:20:40,8,0.3595,834377364947816448,"One thing I will say about Rep. Keith Ellison, in his fight to lead the DNC, is that he was the one who predicted early that I would win!"
944,2017-02-20 21:00:37,8,0.34,833783438922629125,Just named General H.R. McMaster National Security Advisor.
945,2017-02-25 18:12:25,8,0.0,835553050530099200,Weekly Address from @WhiteHouse: https://t.co/uaoQSHBOQB https://t.co/7eF6aC6kEC
946,2017-02-24 13:49:27,8,0.0,835124485632180224,Going to CPAC!
947,2017-02-24 00:06:44,8,0.0,834917440450609152,Big interview tonight by Henry Kravis at The Business Council of Washington. Looking forward to it!
948,2017-02-23 22:53:45,8,0.0,834899071982841856,'S&amp;P 500 Edges Higher After Trump Renews Jobs Pledge' https://t.co/WtrRJVFmvU
949,2017-02-19 21:57:01,8,0.0,833435244451753984,My statement as to what's happening in Sweden was in reference to a story that was broadcast on @FoxNews concerning immigrants &amp; Sweden.
950,2017-02-24 12:31:49,8,-0.0164,835104946034991106,"The FBI is totally unable to stop the national security ""leakers"" that have permeated our government for a long time. They can't even......"
951,2017-02-25 13:19:18,8,-0.0516,835479283699224576,The media has not reported that the National Debt in my first month went down by $12 billion vs a $200 billion increase in Obama first mo.
952,2017-02-20 14:15:42,8,-0.1091,833681539997253636,Give the public a break - The FAKE NEWS media is trying to say that large scale immigration in Sweden is working out just beautifully. NOT!
953,2017-02-21 20:46:42,8,-0.128,834142323881684993,'Americans overwhelmingly oppose sanctuary cities' https://t.co/s5QvsJWA6u
954,2017-02-24 17:04:19,8,-0.3818,835173525522624512,"Trump vows to fight 'epidemic' of human trafficking 
https://t.co/oDLZ2NdrtA"
955,2017-02-24 00:01:40,8,-0.4753,834916167177371648,Seven people shot and killed yesterday in Chicago. What is going on there - totally out of control. Chicago needs help!
956,2017-02-24 12:36:34,8,-0.6486,835106143462703104,find the leakers within the FBI itself. Classified information is being given to media that could have a devastating effect on U.S. FIND NOW
957,2017-02-21 23:23:13,8,-0.7712,834181712783560705,"The so-called angry crowds in home districts of some Republicans are actually, in numerous cases, planned out by liberal activists. Sad!"
958,2017-02-25 03:09:18,8,-0.862,835325771858251776,FAKE NEWS media knowingly doesn't tell the truth. A great danger to our country. The failing @nytimes has become a joke. Likewise @CNN. Sad!
959,2017-02-16 11:34:46,7,0.9392,832191485701451777,Stock market hits new high with longest winning streak in decades. Great level of confidence and optimism - even before tax plan rollout!
960,2017-02-12 15:41:55,7,0.8516,830804130692268032,Congratulations Stephen Miller- on representing me this morning on the various Sunday morning shows. Great job!
961,2017-02-15 19:17:59,7,0.7263,831945670324060164,"Welcome to the United States, @IsraeliPM Benjamin &amp; Sara!
#ICYMIJoint Press Conference: 
https://t.co/GN6ALWUusN https://t.co/bH60nBL5FP"
962,2017-02-14 02:57:05,7,0.7177,831336432073658368,Congratulations Treasury Secretary Steven Mnuchin! #ICYMI- watch here: https://t.co/RPsmw4yD7y https://t.co/K8tWLlXiYK
963,2017-02-14 03:30:45,7,0.7003,831344902990655489,Congratulations to our new #VASecretary Dr. David Shulkin. Time to take care of Veterans who have fought to protect... https://t.co/FNewjbHuw4
964,2017-02-15 16:34:27,7,0.6588,831904516316479489,Great listening session with CEO's of the Retail Industry Leaders Association this morning! https://t.co/sy6xJcWfcF
965,2017-02-14 20:21:59,7,0.6249,831599387906301952,Great parent-teacher listening session this morning with @VP Pence &amp; @usedgov Secretary @BetsyDeVos. Watch:... https://t.co/nuLTs513Ot
966,2017-02-13 18:50:57,7,0.5719,831214091993751552,Wonderful meeting with Canadian PM @JustinTrudeau and a group of leading CEO's &amp; business women from Canadaand th... https://t.co/wAoCOaYeZ6
967,2017-02-17 11:43:10,7,0.571,832555987299082242,Thank you for all of the nice statements on the Press Conference yesterday. Rush Limbaugh said one of greatest ever. Fake media not happy!
968,2017-02-13 16:59:06,7,0.5093,831185943482793986,Welcome to the @WhiteHouse Prime Minister @JustinTrudeau! https://t.co/WKgF8Zo9ri
969,2017-02-17 13:16:22,7,0.3947,832579442790772736,"General Keith Kellogg, who I have known for a long time, is very much in play for NSA - as are three others."
970,2017-02-18 20:26:31,7,0.3802,833050081641234435,"Getting ready to leave for Melbourne, Florida. See you all soon!"
971,2017-02-15 19:45:16,7,0.3595,831952535544070145,"Join me in Florida this Saturday at 5pm for a rally at the Orlando-Melbourne International Airport!
Tickets:... https://t.co/OigfXFECPp"
972,2017-02-15 12:19:18,7,0.3182,831840306161123328,Information is being illegally given to the failing @nytimes &amp; @washingtonpost by the intelligence community (NSA and FBI?).Just like Russia
973,2017-02-17 15:34:14,7,0.296,832614137586933760,"Join me at 11:00am:
Watch here: https://t.co/veqKmsGAwf https://t.co/UzndIjIqjM"
974,2017-02-17 21:48:22,7,0.2867,832708293516632065,"The FAKE NEWS media (failing @nytimes, @NBCNews, @ABC, @CBS, @CNN) is not my enemy, it is the enemy of the American People!"
975,2017-02-15 12:28:37,7,0.228,831842652085686273,"Thank you to Eli Lake of The Bloomberg View - ""The NSA &amp; FBI...should not interfere in our politics...and is"" Very serious situation for USA"
976,2017-02-12 11:55:10,7,0.1027,830747067379232769,"72% of refugees admitted into U.S. (2/3 -2/11) during COURT BREAKDOWN are from 7 countries: SYRIA, IRAQ, SOMALIA, IRAN, SUDAN, LIBYA &amp; YEMEN"
977,2017-02-18 13:51:20,7,0.0,832950628750127106,"Will be having many meetings this weekend at The Southern White House. Big 5:00 P.M. speech in Melbourne, Florida. A lot to talk about!"
978,2017-02-18 00:02:58,7,0.0,832742165436579840,Looking forward to the Florida rally tomorrow. Big crowd expected!
979,2017-02-17 11:38:20,7,0.0,832554772318322688,"Going to Charleston, South Carolina, in order to spend time with Boeing and talk jobs! Look forward to it."
980,2017-02-17 10:13:32,7,0.0,832533430168608768,"Despite the long delays by the Democrats in finally approving Dr. Tom Price, the repeal and replacement of ObamaCare is moving fast!"
981,2017-02-16 23:44:54,7,0.0,832375230274400256,'Trump signs bill undoing Obama coal mining rule' https://t.co/yMfT5r5RGh
982,2017-02-16 12:02:59,7,0.0,832198588201594880,The spotlight has finally been put on the low-life leakers! They will be caught!
983,2017-02-15 12:42:20,7,0.0,831846101179314177,Crimea was TAKEN by Russia during the Obama Administration. Was Obama too soft on Russia?
984,2017-02-14 21:48:10,7,0.0,831621079747723264,"'Remarks by President Trump at Signing of H.J. Resolution 41'
https://t.co/Q3MoCGAc54 https://t.co/yGDDTKm9Br"
985,2017-02-13 15:53:08,7,0.0,831169341358014475,Today I will meet with Canadian PM Trudeau and a group of leading business women to discuss women in the workforce. https://t.co/bFAHPRXHdP
986,2017-02-12 13:04:49,7,0.0,830764596235485188,"After two days of very productive talks, Prime Minister Abe is heading back to Japan. L"
987,2017-02-12 05:02:01,7,0.0,830643095150657536,#ICYMI: Joint Statement with Prime Minister Shinzo Abe on North Korea. https://t.co/qEC87FKB1D
988,2017-02-12 03:23:13,7,0.0,830618234726543360,RT @Scavino45: LIVE Joint Statement by President Trump and Prime Minister Shinzo Abe: https://t.co/c3Fe5cUaaS
989,2017-02-18 13:31:53,7,-0.0766,832945737625387008,Don't believe the main stream (fake news) media.The White House is running VERY WELL. I inherited a MESS and am in the process of fixing it.
990,2017-02-14 22:50:33,7,-0.0772,831636777110757377,"Obamacare continues to fail. Humana to pull out in 2018. Will repeal, replace &amp; save healthcare for ALL Americans. 
https://t.co/glWEQ0lNR4"
991,2017-02-15 13:13:10,7,-0.1759,831853862281699331,"The real scandal here is that classified information is illegally given out by ""intelligence"" like candy. Very un-American!"
992,2017-02-16 14:10:49,7,-0.3532,832230758299340800,"FAKE NEWS media, which makes up stories and ""sources,"" is far more effective than the discredited Democrats - but they are fading fast!"
993,2017-02-15 23:59:26,7,-0.3818,832016501657968640,"Venezuela should allow Leopoldo Lopez, a political prisoner &amp; husband of @liliantintori (just met w/ @marcorubio) o... https://t.co/HhgE51dtSN"
994,2017-02-12 22:19:05,7,-0.4621,830904083519242241,Just leaving Florida. Big crowds of enthusiastic supporters lining the road that the FAKE NEWS media refuses to mention. Very dishonest!
995,2017-02-17 21:32:29,7,-0.5358,832704292993847296,"The FAKE NEWS media (failing @nytimes, @CNN, @NBCNews and many more)    is not my enemy, it is the enemy of the American people. SICK!"
996,2017-02-15 21:34:05,7,-0.5994,831979921555742732,"Aetna CEO: Obamacare in 'Death Spiral' #RepealAndReplace 
https://t.co/dmHL7xIEQv"
997,2017-02-14 14:28:54,7,-0.6415,831510532318429184,The real story here is why are there so many illegal leaks coming out of Washington? Will these leaks be happening as I deal on N.Korea etc?
998,2017-02-12 13:23:18,7,-0.6669,830769247185952772,I know Mark Cuban well. He backed me big-time but I wasn't interested in taking all of his calls.He's not smart enough to run for president!
999,2017-02-17 23:15:56,7,-0.6931,832730328108134402,"""One of the most effective press conferences I've ever seen!"" says Rush Limbaugh. Many agree.Yet FAKE MEDIA  calls it differently! Dishonest"
1000,2017-02-12 11:34:45,7,-0.7424,830741932099960834,"The crackdown on illegal criminals is merely the keeping of my campaign promise. Gang members, drug dealers &amp; others are being removed!"
1001,2017-02-15 12:08:12,7,-0.743,831837514226921472,This Russian connection non-sense is merely an attempt to cover-up the many mistakes made in Hillary Clinton's losing campaign.
1002,2017-02-16 11:58:43,7,-0.8588,832197515248275456,"Leaking, and even illegal classified leaking, has been a big problem in Washington for years. Failing @nytimes (and others) must apologize!"
1003,2017-02-16 14:39:52,7,-0.8652,832238070460186625,"The Democrats had to come up with a story as to why they lost the election, and so badly (306), so they made up a story - RUSSIA. Fake news!"
1004,2017-02-12 12:14:16,7,-0.8891,830751875578355713,"While on FAKE NEWS @CNN, Bernie Sanders was cut off for using the term fake news to describe the network. They said technical difficulties!"
1005,2017-02-15 11:40:32,7,-0.8999,831830548565852160,The fake news media is going crazy with their conspiracy theories and blind hatred. @MSNBC &amp; @CNN are unwatchable. @foxandfriends is great!
1006,2017-02-06 03:36:54,6,0.9412,828447350200926212,"What an amazing comeback and win by the Patriots. Tom Brady, Bob Kraft and Coach B are total winners. Wow!"
1007,2017-02-08 15:23:29,6,0.9118,829349943613734912,Thank you to our great Police Chiefs &amp; Sheriffs for your leadership &amp; service. You have a true friend in the... https://t.co/Lysnv8ZR1h
1008,2017-02-08 19:22:33,6,0.8814,829410107406614534,"Thank you Brian Krzanich, CEO of @Intel. A great investment ($7 BILLION) in American INNOVATION and JOBS!... https://t.co/oicfDsPKHQ"
1009,2017-02-05 22:49:42,6,0.8528,828375073006444544,Enjoy the #SuperBowl and then we continue: MAKE AMERICA GREAT AGAIN!
1010,2017-02-11 23:15:34,6,0.8475,830555911559249926,"Played golf today with Prime Minister Abe of Japan and @TheBig_Easy, Ernie Els, and had a great time. Japan is very well represented!"
1011,2017-02-06 23:33:52,6,0.8122,828748574255091714,An extended interview from the Super Bowl with @oreillyfactor airs tonight at 8:00 P.M. Enjoy! https://t.co/kZdHqaNTVR
1012,2017-02-05 00:34:50,6,0.8122,828039143318024194,Interview with @oreillyfactor on Fox Network - 4:00 P.M. (prior to Super Bowl). Enjoy!
1013,2017-02-11 18:28:31,6,0.8016,830483672096768001,"Having a great time hosting Prime Minister Shinzo Abe in the United States! 
https://t.co/Fvjsac89qS... https://t.co/hKqbMB2aQ9"
1014,2017-02-07 16:25:13,6,0.7906,829003091735359488,An honor having the National Sheriffs' Assoc. join me at the @WhiteHouse. Incredible men &amp; women who protect &amp; serv... https://t.co/1LkhbCNh8L
1015,2017-02-11 23:07:52,6,0.7773,830553970225590277,"Playef golf today with Prime Minister Abe of Japan and @TheBig_Easy, Ernie Els, and had a great time. Japan is very well represented!"
1016,2017-02-09 13:52:31,6,0.7345,829689436279603206,"..Ryan died on a winning mission ( according to General Mattis), not a ""failure."" Time for the U.S. to get smart and start winning again!"
1017,2017-02-08 17:41:09,6,0.7296,829384587482656768,"Big increase in traffic into our country from certain areas, while our people are far more vulnerable, as we wait for what should be EASY D!"
1018,2017-02-09 01:05:53,6,0.636,829496507841789952,"Congratulations to our new Attorney General, @SenatorSessions! https://t.co/e0buP1K83z"
1019,2017-02-11 13:33:53,6,0.6114,830409522397184000,"Melania and I are hosting Japanese Prime Minister Shinzo Abe and Mrs. Abe at Mar-a-Lago in Palm Beach, Fla. They are a wonderful couple!"
