,created_date,week,sentiment.compound,id,text-encoded
282,2017-06-27 11:23:35,26,0.0,879661481360588800,RT @foxandfriends: President Trump officially nominates former Assistant Attorney General Christopher Wray to head the FBI https://t.co/ld7...
283,2017-06-27 11:19:39,26,0.0,879660494218547202,RT @foxandfriends: Another Dem 'queasy' over claim of Loretta Lynch meddling in Clinton case https://t.co/wdQ9MduxOO
284,2017-06-27 11:00:53,26,0.0,879655772111679488,RT @foxandfriends: Hannity: Russia allegations 'boomeranging back' on Democrats https://t.co/lvdrpxpcp9
285,2017-06-27 11:00:07,26,0.0,879655576803913728,RT @foxandfriends: Mark Levin: The collusion is among the Democrats https://t.co/Qrca7r01BI
286,2017-06-27 10:46:02,26,0.0,879652031799205888,RT @JeffTutorials: @realDonaldTrump  https://t.co/6sDcyiW4Kt
287,2017-06-27 01:30:15,26,0.0,879512164553420809,"RT @WhiteHouse: FACT: when #Obamacare was signed, CBO estimated that 23M would be covered in 2017. They were off by 100%. Only 10.3M people..."
288,2017-06-26 12:59:31,26,0.0,879323238425395200,The real story is that President Obama did NOTHING after being informed in August about Russian meddling. With 4 months looking at Russia...
289,2017-06-26 12:37:16,26,0.0,879317636164841474,The reason that President Obama did NOTHING about Russia after being notified by the CIA of meddling is that he expected Clinton would win..
290,2017-06-29 22:28:23,26,-0.0772,880553561008078848,Good news out of the House with the passing of 'No Sanctuary for Criminals Act.' Hopefully Senate will follow.
291,2017-07-01 12:59:52,26,-0.3595,881135264441257984,Word is that @Greta Van Susteren was let go by her out of control bosses at @NBC &amp; @Comcast because she refused to go along w/ 'Trump hate!'
292,2017-06-27 02:24:30,26,-0.5093,879525817361068032,"From @FoxNews ""Bombshell: In 2016, Obama dismissed idea that anyone could rig an American election.""  Check out his statement - Witch Hunt!"
293,2017-06-30 20:55:44,26,-0.5106,880892632142143490,The era of strategic patience with the North Korea regime has failed. That patience is over. We are working closely... https://t.co/MxN04V2Yn4
294,2017-06-26 18:16:24,26,-0.5106,879402984756711425,RT @WhiteHouse: #Obamacare has led to higher costs and fewer health insurance options for millions of Americans. It has failed the American...
295,2017-06-25 12:00:37,26,-0.522,878946025662296064,Hillary Clinton colluded with the Democratic Party in order to beat Crazy Bernie Sanders. Is she allowed to so collude? Unfair to Bernie!
296,2017-06-27 12:30:38,26,-0.5255,879678356450676736,Fake News CNN is looking at big management changes now that they got caught falsely pushing their phony Russian stories. Ratings way down!
297,2017-06-28 13:06:14,26,-0.5307,880049704620494848,"The #AmazonWashingtonPost, sometimes referred to as the guardian of Amazon not paying internet taxes (which they should) is FAKE NEWS!"
298,2017-06-28 10:58:59,26,-0.5385,880017678978736129,"Some of the Fake News Media likes to say that I am not totally engaged in healthcare. Wrong, I know the subject well &amp; want victory for U.S."
299,2017-07-01 22:02:12,26,-0.5549,881271748280365056,"The FAKE &amp; FRAUDULENT NEWS MEDIA is working hard to convince Republicans and others I should not use social media - but remember, I won...."
300,2017-06-27 22:22:55,26,-0.6588,879827411008974852,"With ZERO Democrats to help, and a failed, expensive and dangerous ObamaCare as the Dems legacy, the Republican Senators are working hard!"
301,2017-06-28 10:49:22,26,-0.6696,880015261004435456,The failing @nytimes writes false story after false story about me. They don't even call to verify the facts of a story. A Fake News Joke!
302,2017-06-29 12:27:35,26,-0.6712,880402366373269504,New Sugar deal negotiated with Mexico is a very good one for both Mexico and the U.S. Had no deal for many years which hurt U.S. badly.
303,2017-06-29 12:58:23,26,-0.68,880410114456465411,"...to Mar-a-Lago 3 nights in a row around New Year's Eve, and insisted on joining me. She was bleeding badly from a face-lift. I said no!"
304,2017-06-26 13:05:01,26,-0.69,879324620159160322,"..under a magnifying glass, they have zero ""tapes"" of T people colluding. There is no collusion &amp; no obstruction. I should be given apology!"
305,2017-06-27 10:33:42,26,-0.6932,879648931172556802,"Wow, CNN had to retract big story on ""Russia,"" with 3 employees forced to resign. What about all the other phony stories they do? FAKE NEWS!"
306,2017-06-29 22:53:49,26,-0.7096,880559961855729664,Statement on House Passage of Kates Law and No Sanctuary for Criminals Act. https://t.co/uPRy9XgK5A
307,2017-06-29 01:51:18,26,-0.7096,880242238000955392,Tomorrow the House votes on #KatesLaw &amp; No Sanctuary For Criminals Act. Lawmakers must vote to put American safety... https://t.co/p3vd8IXXaD
308,2017-06-28 11:03:33,26,-0.7096,880018828603912194,RT @foxandfriends: HAPPENING TODAY: House to vote on immigration bills including 'Kates Law' and 'No Sanctuary for Criminals Act' https://...
309,2017-06-26 12:30:12,26,-0.722,879315860178993152,"The Democrats have become nothing but OBSTRUCTIONISTS, they have no policies or ideas. All they do is delay and complain.They own ObamaCare!"
310,2017-06-30 10:48:38,26,-0.7345,880739852286918656,Crime and killings in Chicago have reached such epidemic proportions that I am sending in Federal help. 1714 shootings in Chicago this year!
311,2017-06-29 12:52:17,26,-0.765,880408582310776832,"I heard poorly rated @Morning_Joe speaks badly of me (don't watch anymore). Then how come low I.Q. Crazy Mika, along with Psycho Joe, came.."
312,2017-07-01 13:07:05,26,-0.848,881137079958241280,Numerous states are refusing to give information to the very distinguished VOTER FRAUD PANEL. What are they trying to hide?
313,2017-06-29 21:13:22,26,-0.8519,880534684479897600,"""Mattis Says Trumps Warning Stopped Chemical Weapons Attack In Syria"" https://t.co/XL9LLNKh8i"
314,2017-06-27 12:47:17,26,-0.9158,879682547235651584,"So they caught Fake News CNN cold, but what about NBC, CBS &amp; ABC? What about the failing @nytimes &amp; @washingtonpost? They are all Fake News!"
315,2017-06-30 12:55:08,26,-0.9205,880771685460344832,Watched low rated @Morning_Joe for first time in long time. FAKE NEWS. He called me to stop a National Enquirer article. I said no! Bad show
316,2017-06-21 03:12:00,25,0.9652,877363446530007040,Ralph Norman ran a fantastic race to win in the Great State of South Carolina's 5th District. We are all honored by your success tonight!
317,2017-06-21 02:41:23,25,0.9431,877355739383287808,"Congratulations to Karen Handel on her big win in Georgia 6th. Fantastic job, we are all very proud of you!"
318,2017-06-18 21:51:39,25,0.9219,876558049565188096,Camp David is a very special place. An honor to have spent the weekend there. Military runs it so well and are so proud of what they do!
319,2017-06-20 09:52:26,25,0.891,877101828143542272,"RT @SheriffClarke: Happy Father's Day to all dads. My dad. Like father, like son, @realDonaldTrump supporters to the end. He an Airborne Ra..."
320,2017-06-21 02:33:40,25,0.8834,877353797760286720,"Thank you @FoxNews ""Huge win for President Trump and GOP in Georgia Congressional Special Election."""
321,2017-06-21 01:42:59,25,0.8834,877341043171241984,"It was a great honor to welcome President Petro Poroshenko of Ukraine to the @WhiteHouse today with @VP Pence.
... https://t.co/J1ulOd6pYQ"
322,2017-06-19 21:53:56,25,0.8834,876921011668738050,"It was my great honor to welcome President @JC_Varela &amp; Mrs. Varela from Panama this afternoon.
... https://t.co/770OJj2uYb"
323,2017-06-22 11:11:25,25,0.8622,877846483021602816,Great night in Iowa - special people. Thank you!
324,2017-06-23 02:33:37,25,0.8176,878078560715538432,.@FLOTUS &amp; I were honored to host our first WH Congressional Picnic. A wonderful evening &amp; tradition. @MarineBand:... https://t.co/h5L4myWmam
325,2017-06-21 23:48:58,25,0.8091,877674738364989440,Thank you Kirkwood Community College. Heading to the U.S. Cellular Center now for an 8pmE MAKE AMERICA GREAT AGAIN... https://t.co/n6LS32a6Zn
326,2017-06-21 03:48:37,25,0.7978,877372660455546880,"Well, the Special Elections are over and those that want to MAKE AMERICA GREAT AGAIN are 5 and O! All the Fake News, all the money spent = 0"
327,2017-06-22 13:18:09,25,0.7964,877878375045447680,Former Homeland Security Advisor Jeh Johnson is latest top intelligence official to state there was no grand scheme between Trump &amp; Russia.
328,2017-06-18 10:38:51,25,0.7851,876388733607694336,"The MAKE AMERICA GREAT AGAIN agenda is doing very well despite the distraction of the Witch Hunt. Many new jobs, high business enthusiasm,.."
329,2017-06-19 20:27:27,25,0.7777,876899250071904256,....getting great border security and healthcare. #VoteRalphNorman tomorrow!
330,2017-06-19 23:57:48,25,0.7306,876952186143506432,RT @joegooding: What's happening in our country isn't just an assault on our @POTUS @realDonaldTrump it's an assault on the American people...
331,2017-06-22 23:12:12,25,0.729,878027873650475008,"Together, we are going to MAKE AMERICA GREAT AGAIN!
#AmericaFirst https://t.co/MVJbs44AtR"
332,2017-06-20 18:38:11,25,0.7171,877234140483121152,"While I greatly appreciate the efforts of President Xi &amp; China to help with North Korea, it has not worked out. At least I know China tried!"
333,2017-06-21 10:32:46,25,0.7088,877474368661618688,"Democrats would do much better as a party if they got together with Republicans on Healthcare,Tax Cuts,Security. Obstruction doesn't work!"
334,2017-06-22 14:15:48,25,0.7003,877892883352702976,I certainly hope the Democrats do not force Nancy P out. That would be very bad for the Republican Party - and please let Cryin' Chuck stay!
335,2017-06-19 20:27:10,25,0.7003,876899176562524160,"Ralph Norman, who is running for Congress in SC's 5th District, will be a fantastic help to me in cutting taxes, and...."
336,2017-06-24 21:23:52,25,0.6588,878725385235701761,MAKE AMERICA GREAT AGAIN!
337,2017-06-21 02:21:36,25,0.6588,877350761742688256,Things are looking great for Karen H!
338,2017-06-18 21:52:26,25,0.6114,876558248631042049,RT @WhiteHouse: Happy Father's Day! https://t.co/32tFoVa4Ov
339,2017-06-23 10:39:50,25,0.5562,878200921980891136,"I've helped pass and signed 38 Legislative Bills, mostly with no Democratic support, and gotten rid of massive amounts of regulations. Nice!"
340,2017-06-19 20:15:07,25,0.5423,876896144944762880,My heartfelt thoughts and prayers are with the 7 @USNavy sailors of the #USSFitzgerald and their families. ... https://t.co/L3u5c8Iymh
341,2017-06-23 10:07:50,25,0.5411,878192867847675904,Will be on @foxandfriends. Enjoy!
342,2017-06-20 10:02:06,25,0.5411,877104262463008771,"KAREN HANDEL FOR CONGRESS. She will fight for lower taxes, great healthcare strong security-a hard worker who will never give up! VOTE TODAY"
343,2017-06-18 11:02:04,25,0.5255,876394578777174021,"The new Rasmussen Poll, one of the most accurate in the 2016 Election, just out with a Trump 50% Approval Rating.That's higher than O's #'s!"
344,2017-06-23 19:56:29,25,0.4939,878341007103987712,"Today, it was a tremendous honor for me to sign the #VAaccountability Act into law, delivering my campaign promise... https://t.co/G0k8nFWqNj"
345,2017-06-19 23:56:27,25,0.4767,876951845880688644,"RT @FoxNews: New Poll Shows @POTUS Approval at 50 Percent
https://t.co/FRWlSVvxzQ"
346,2017-06-24 20:44:36,25,0.3724,878715504063643648,"Obama Administration official said they ""choked"" when it came to acting on Russian meddling of election. They didn't want to hurt Hillary?"
347,2017-06-22 21:49:07,25,0.3612,878006964072189952,"As promised, our campaign against the MS-13 gang continues. 

""@ICEgov Busts 39 MS-13 Members in New York Operation""
https://t.co/ki41GXeCMy"
348,2017-06-18 21:28:25,25,0.3382,876552203187736577,"RT @DonaldJTrumpJr: Not surprising at all! 
Father Of Otto Warmbier: Obama Admin Told Us To Keep Quiet, Trump Admin Brought Him Home  https..."
349,2017-06-18 10:46:35,25,0.2481,876390681056600066,"...massive regulation cuts, 36 new legislative bills signed, great new S.C.Justice, and Infrastructure, Healthcare and Tax Cuts in works!"
350,2017-06-22 22:40:27,25,0.1225,878019881353871360,"I am very supportive of the Senate #HealthcareBill. Look forward to making it really special! Remember, ObamaCare is dead."
351,2017-06-23 03:00:00,25,0.0772,878085201494147076,RT @foxnation: .@SenTedCruz: I want to Get to a 'Yes' Vote: https://t.co/g0vafw4ef2
352,2017-06-22 13:22:04,25,0.0056,877879361130688512,"By the way, if Russia was working so hard on the 2016 Election, it all took place during the Obama Admin. Why didn't they stop them?"
353,2017-06-24 00:43:48,25,0.0,878413313188802560,Just out: The Obama Administration knew far in advance of November 8th about election meddling by Russia. Did nothing about it. WHY?
354,2017-06-23 21:32:29,25,0.0,878365166538285057,WEEKLY ADDRESS https://t.co/P1f12i9Gvt
355,2017-06-23 03:02:26,25,0.0,878085811941539849,RT @foxandfriends: POTUS the predictor? President Trump foretold housing upswing in 2012 https://t.co/N3LMDZKTK1
356,2017-06-22 23:27:50,25,0.0,878031806506848256,We're all thinking of you @SteveScalise! #TeamScalise https://t.co/Yqf6exhm7x
357,2017-06-22 22:15:39,25,0.0,878013639613186049,"Mexico was just ranked the second deadliest country in the world, after only Syria. Drug trade is largely the cause. We will BUILD THE WALL!"
358,2017-06-22 16:55:02,25,0.0,877932956458795008,"...whether there are ""tapes"" or recordings of my conversations with James Comey, but I did not make, and do not have, any such recordings."
359,2017-06-21 23:04:54,25,0.0,877663648713330688,Just landed in Iowa. See everyone soon! #MAGA
360,2017-06-19 23:44:02,25,0.0,876948721468141573,Melania and I offer our deepest condolences to the family of Otto Warmbier. Full statement: https://t.co/8kmcA6YtFD https://t.co/EhrP4BiJeB
361,2017-06-19 20:34:11,25,0.0,876900944444837890,Karen Handel's opponent in #GA06 can't even vote in the district he wants to represent....
362,2017-06-19 20:29:38,25,0.0,876899797994790912,Karen Handle's opponent in #GA06 can't even vote in the district he wants to represent....
363,2017-06-19 11:59:56,25,0.0,876771526208626688,Jay Sekulow on @foxandfriends now.
364,2017-06-18 21:07:12,25,-0.0258,876546864669237253,"RT @DiamondandSilk: The Media Says:  The President Should Stop Tweeting about Russia. 
 Well, Why Don't the Media Take Their Own Advice &amp; S..."
365,2017-06-24 12:51:33,25,-0.0772,878596457741287424,"Democrats slam GOP healthcare proposal as Obamacare premiums &amp; deductibles increase by over 100%. Remember keep your doctor, keep your plan?"
366,2017-06-22 14:01:10,25,-0.1343,877889199353077760,...Why did Democratic National Committee turn down the DHS offer to protect against hacks (long prior to election). It's all a big Dem HOAX!
367,2017-06-24 20:28:46,25,-0.3595,878711517537083392,"Since the Obama Administration was told way before the 2016 Election that the Russians were meddling, why no action? Focus on them, not T!"
368,2017-06-24 20:50:56,25,-0.5992,878717095701336064,I cannot imagine that these very fine Republican Senators would allow the American people to suffer a broken ObamaCare any longer!
369,2017-06-20 09:49:50,25,-0.6124,877101173412638720,"Democrat Jon Ossoff, who wants to raise your taxes to the highest level and is weak on crime and security, doesn't even live in district."
370,2017-06-19 12:27:01,25,-0.6705,876778344636928000,"The Dems want to stop tax cuts, good healthcare and Border Security.Their ObamaCare is dead with 100% increases in P's. Vote now for Karen H"
371,2017-06-22 16:54:50,25,-0.7003,877932907137966080,"With all of the recently reported electronic surveillance, intercepts, unmasking and illegal leaking of information, I have no idea..."
372,2017-06-19 20:35:37,25,-0.7177,876901304207069185,"....because he doesn't even live there! He wants to raise taxes and kill healthcare. On Tuesday, #VoteKarenHandel."
373,2017-06-19 20:29:59,25,-0.7177,876899886272319489,"....because he doesn't live there! He wants to raise taxes &amp; kill healthcare. On Tuesday, #VoteKarenHandel."
374,2017-06-20 00:45:00,25,-0.7574,876964061027684352,"Big day tomorrow in Georgia and South Carolina. ObamaCare is dead. Dems want to raise taxes big! They can only obstruct, no ideas. Vote ""R"""
375,2017-06-22 14:08:50,25,-0.8491,877891129194102785,"...Why did the DNC REFUSE to turn over its Server to the FBI, and still hasn't? It's all a big Dem scam and excuse for losing the election!"
376,2017-06-20 16:41:10,25,-0.9042,877204691851108353,The U.S. once again condemns the brutality of the North Korean regime as we mourn its latest victim. Video: https://t.co/Rvm11ZbPk7
377,2017-06-14 14:07:31,24,0.9151,874991696186142721,"Happy birthday to U.S. ARMY and our soldiers. Thank you for your bravery, sacrifices, &amp; dedication. Proud to be your Commander-in-Chief!"
378,2017-06-15 21:43:14,24,0.8908,875468769212149760,"Thank you Wisconsin! Tuesday was a great success for #WorkforceWeek at @WCTC w/ @IvankaTrump &amp; @GovWalker. 
Remarks... https://t.co/L8o396yYKX"
379,2017-06-17 01:30:08,24,0.8847,875888258407858176,Back from Miami where my Cuban/American friends are very happy with what I signed today. Another campaign promise that I did not forget!
380,2017-06-14 02:53:45,24,0.8588,874822136782880768,"Just got back from Wisconsin. Great day, great people!"
381,2017-06-16 22:32:20,24,0.8126,875843513761583104,"""National Security Presidential Memorandum on Strengthening the Policy of the United States Toward Cuba""
Memorandum... https://t.co/RVr9Dg2hXt"
382,2017-06-15 01:41:45,24,0.8045,875166406417010688,"Just left hospital. Rep. Steve Scalise, one of the truly great people, is in very tough shape - but he is a real fighter. Pray for Steve!"
383,2017-06-13 13:29:59,24,0.8016,874619861019840512,"Heading to the Great State of Wisconsin to talk about JOBS, JOBS, JOBS! Big progress being made as the Real News is reporting."
384,2017-06-12 21:10:10,24,0.795,874373283919089664,"Finally held our first full @Cabinet meeting today. With this great team, we can restore American prosperity and br... https://t.co/b0roksHTFE"
385,2017-06-15 10:55:37,24,0.7351,875305788708974592,"They made up a phony collusion with the Russians story, found zero proof, so now they go for obstruction of justice on the phony story. Nice"
386,2017-06-13 23:18:19,24,0.729,874767922295705600,The passage of the @DeptVetAffairs Accountability and Whistleblower Protection Act is GREAT news for veterans! I lo... https://t.co/k45aci25BT
387,2017-06-16 12:54:22,24,0.6996,875698062030778368,"Despite the phony Witch Hunt going on in America, the economic &amp; jobs numbers are great. Regulations way down, jobs and enthusiasm way up!"
388,2017-06-16 15:12:27,24,0.6588,875732813278048256,Great news! #MAGA https://t.co/pirHR7lAyT
389,2017-06-13 00:09:54,24,0.636,874418514240688129,"Congratulations to the 2016 @ClemsonFB Tigers!
Full ceremony: https://t.co/syJUGoMhHJ
#NationalChampions https://t.co/F23NZoX2BI"
390,2017-06-12 17:59:27,24,0.636,874325287143604224,"Congratulations! 

'First New Coal Mine of Trump Era Opens in Pennsylvania' https://t.co/aIRllxNLQA"
391,2017-06-12 02:02:23,24,0.5411,874084433460154368,"My daughter, Ivanka, will be on @foxandfriends tomorrow morning. Enjoy!"
392,2017-06-14 02:50:17,24,0.4019,874821262987730944,RT @TuckerCarlson: .@RichardGrenell : @realDonaldTrump told Tillerson he had the full support of the U.S. Gov't to bring #OttoWarmbier home...
393,2017-06-17 14:08:48,24,0.3612,876079184417882116,Thoughts and prayers with the sailors of USS Fitzgerald and their families. Thank you to our Japanese allies for th... https://t.co/BBvmTFxVkk
394,2017-06-12 02:09:10,24,0.2023,874086142425083904,RT @foxandfriends: .@GeraldoRivera: Chances of impeachment went from 3% to 0% with Comey's testimony https://t.co/kfeXKdpJGe
395,2017-06-11 12:49:00,24,0.2008,873884774041079808,"The Democrats have no message,  not on economics, not on taxes,  not on jobs, not on failing #Obamacare. They are only OBSTRUCTIONISTS!"
396,2017-06-14 12:48:26,24,0.0258,874971795362897921,"Rep. Steve Scalise of Louisiana, a true friend and patriot, was badly injured but will fully recover. Our thoughts and prayers are with him."
397,2017-06-17 01:31:01,24,0.0,875888479942651909,RT @seanhannity: #Hannity Starts in 30 minutes with @newtgingrich and my monologue on the Deep States allies in the media
398,2017-06-16 22:18:54,24,0.0,875840132238032897,"""Remarks by President Trump on the Policy of the U.S.A. Towards Cuba""
Video: https://t.co/jUWCjgxX5D
Transcript:... https://t.co/hILCHbPJet"
399,2017-06-15 23:49:24,24,0.0,875500520840060928,#CongressionalBaseballGame https://t.co/u8InOJTf6D
400,2017-06-15 19:43:31,24,0.0,875438639823675392,"Why is that Hillary Clintons family and Dems dealings with Russia are not looked at, but my non-dealings are?"
401,2017-06-13 20:41:37,24,0.0,874728484475744257,"Just arrived in Wisconsin to discuss JOBS, JOBS, JOBS! #MAGA https://t.co/lEJ9S817yb"
402,2017-06-12 10:55:27,24,0.0,874218586155479040,Ivanka on @foxandfriends now!
403,2017-06-12 02:07:30,24,0.0,874085723762286592,"RT @foxandfriends: ""Yesterday's hearings provided zero evidence of collusion between our campaign and the Russians because there wasn't any..."
404,2017-06-11 12:23:01,24,0.0,873878232264822784,"...way up. Regulations way down. 600,000+ new jobs added. Unemployment down to 4.3%. Business and economic enthusiasm way up- record levels!"
405,2017-06-12 02:14:29,24,-0.1511,874087477807599616,"Great numbers on the economy. All of our work, including the passage of many bills &amp; regulation killing Executive Orders, now kicking in!"
406,2017-06-13 12:45:11,24,-0.2228,874608587473080320,A.G. Lynch made law enforcement decisions for political purposes...gave Hillary Clinton a free pass and protection. Totally illegal!
407,2017-06-11 12:22:20,24,-0.2946,873878061778907137,The #FakeNews MSM doesn't report the great economic news since Election Day. #DOW up 16%. #NASDAQ up 19.5%. Drilling &amp; energy sector...
408,2017-06-15 19:56:01,24,-0.4215,875441788110110727,"Crooked H destroyed phones w/ hammer, 'bleached' emails, &amp; had husband meet w/AG days before she was cleared- &amp; they talk about obstruction?"
409,2017-06-13 12:07:36,24,-0.4329,874599130018054145,RT @Corrynmb: @realDonaldTrump Liberals have an agenda and it's not in America's best interest. Keep fighting the good fight! We stand with...
410,2017-06-15 11:57:57,24,-0.4798,875321478849363968,You are witnessing the single greatest WITCH HUNT in American political history - led by some very bad and conflicted people!  #MAGA
411,2017-06-16 12:23:08,24,-0.4937,875690204564258816,The Fake News Media hates when I use what has turned out to be my very powerful Social Media - over 100 million people! I can go around them
412,2017-06-16 11:53:56,24,-0.5255,875682853585129472,"After 7 months of investigations &amp; committee hearings about my ""collusion with the Russians,""  nobody has been able to show any proof. Sad!"
413,2017-06-13 12:48:44,24,-0.533,874609480301936640,Fake News is at an all time high. Where is their apology to me for all of the incorrect stories???
414,2017-06-11 12:29:46,24,-0.6352,873879934040780801,I believe the James Comey leaks will be far more prevalent than anyone ever thought possible. Totally illegal? Very 'cowardly!'
415,2017-06-13 10:44:16,24,-0.7456,874578159676665857,"Well, as predicted, the 9th Circuit did it again - Ruled against the TRAVEL BAN at such a dangerous time in the history of our country. S.C."
416,2017-06-13 13:56:20,24,-0.75,874626492310978564,"2 million more people just dropped out of ObamaCare. It is in a death spiral. Obstructionist Democrats gave up, have no answer = resist!"
417,2017-06-16 13:07:55,24,-0.7644,875701471999864833,I am being investigated for firing the FBI Director by the man who told me to fire the FBI Director! Witch Hunt
418,2017-06-12 16:58:25,24,-0.8918,874309930232184833,We will NEVER FORGET the victims who lost their lives one year ago today in the horrific #PulseNightClub shooting.... https://t.co/7lZGgDJkxZ
419,2017-06-13 10:35:55,24,-0.9544,874576057579565056,The Fake News Media has never been so wrong or so dirty. Purposely incorrect stories and phony sources to meet their agenda of hate. Sad!
420,2017-06-05 20:45:05,23,0.922,871830255396192256,".@SecShulkin's decision is one of the biggest wins for our VETERANS in decades. Our HEROES deserve the best! 
... https://t.co/RnNp9q7Tdh"
421,2017-06-09 14:22:00,23,0.9067,873183401620230144,Congratulations to Jeb Hensarling &amp; Republicans on successful House vote to repeal major parts of the 2010 Dodd-Frank financial law. GROWTH!
422,2017-06-09 18:48:54,23,0.8834,873250570508922880,A great honor to host and welcome leaders from around America to the @WhiteHouse Infrastructure Summit.... https://t.co/5f6cN3HboQ
423,2017-06-09 22:52:23,23,0.8814,873311842956914688,"It is time to rebuild OUR country, to bring back OUR jobs, to restore OUR dreams, &amp; yes, to put #AmericaFirst! TY O... https://t.co/2b2bXwxGkA"
424,2017-06-09 10:54:43,23,0.7995,873131235614347264,Great reporting by @foxandfriends and so many others. Thank you!
425,2017-06-06 17:47:33,23,0.7506,872147965451882496,Today we remember the courage and bravery of our troops that stormed the beaches of Normandy 73 years ago. #DDay... https://t.co/zhR24dMzYB
426,2017-06-07 12:17:13,23,0.729,872427222392504320,"Getting ready to leave for Cincinnati, in the GREAT STATE of OHIO, to meet with ObamaCare victims and talk Healthcare &amp; also Infrastructure!"
427,2017-06-05 10:44:18,23,0.7088,871679061847879682,In any event we are EXTREME VETTING people coming into the U.S. in order to help keep our country safe. The courts are slow and political!
