,created_date,week,sentiment.compound,id,text-encoded
1123,2017-04-14 21:46:20,15,0.0,853001499747725317,b'RT @FLOTUS: Looking forward to hosting the annual Easter Egg Roll at the @WhiteHouse on Monday! https://t.co/nz7vucugx9'
1124,2017-04-14 20:41:25,15,0.0,852985162870738944,b'Weekly Address- https://t.co/tpZ7eqJLUH https://t.co/B2NQzj53ft'
1125,2017-04-09 15:21:07,15,0.0,851092618754891781,b'...confidence that President Al Sisi will handle situation properly.'
1126,2017-04-12 12:22:22,15,-0.0018,852134796436398086,b'Had a very good call last night with the President of China concerning the menace of North Korea.'
1127,2017-04-14 03:18:24,15,-0.9022,852722680851779584,"b""RT @DRUDGE_REPORT: GREAT AGAIN: FEDS ARREST MURDER SUSPECT IN 'FAST AND FURIOUS' SCANDAL... https://t.co/clOLxTE3D4"""
1128,2017-04-09 15:20:39,15,-0.9245,851092500056072198,b'So sad to hear of the terrorist attack in Egypt. U.S. strongly condemns. I have great...'
1129,2017-04-08 19:58:32,14,0.9039,850800045012201473,b'Judge Gorsuch will be sworn in at the Rose Garden of the White House on Monday at 11:00 A.M. He will be a great Justice. Very proud of him!'
1130,2017-04-05 21:18:08,14,0.8908,849732911377117185,"b""I am deeply committed to preserving our strong relationship &amp; to strengthening America's long-standing support for... https://t.co/GxrOR3ALCE"""
1131,2017-04-08 14:54:24,14,0.887,850723509370327040,"b'Congratulations to our great military men and women for representing the United States, and the world, so well in the Syria attack.'"
1132,2017-04-08 14:50:59,14,0.8779,850722648883638272,b'It was a great honor to have President Xi Jinping and Madame Peng Liyuan of China as our guests in the United States. Tremendous...'
1133,2017-04-04 21:03:51,14,0.8622,849366930133839872,b'Great to talk jobs with #NABTU2017. Tremendous spirit &amp; optimism - we will deliver! https://t.co/6lRuQZZHrc'
1134,2017-04-03 16:00:33,14,0.8402,848928217138384896,"b'Getting ready to meet President al-Sisi of Egypt. On behalf of the United States, I look forward to a long and wonderful relationship.'"
1135,2017-04-07 23:22:53,14,0.7645,850489084221018113,"b""RT @IvankaTrump: Very proud of Arabella and Joseph for their performance in honor of President Xi Jinping and Madame Peng Liyuan's official..."""
1136,2017-04-06 18:30:49,14,0.7579,850053194923298816,"b'It was an honor to host our American heroes from the @WWP #SoldierRideDC at the @WhiteHouse today with @FLOTUS, @VP... https://t.co/u5AI1pupVV'"
1137,2017-04-04 19:38:59,14,0.7506,849345573509574665,b'Thank you Sean McGarvey &amp; the entire Governing Board of Presidents for honoring me w/an invite to speak. #NABTU2017... https://t.co/dJlZvlq6Tj'
1138,2017-04-03 19:39:05,14,0.7351,848983209580822529,b'It was an honor to welcome President Al Sisi of Egypt to the @WhiteHouse as we renew the historic partnership betwe... https://t.co/9mRaGvcPHz'
1139,2017-04-03 00:58:29,14,0.7184,848701201315188736,"b'Melania and I are honored to light up the @WhiteHouse this evening, for \n#WorldAutismAwarenessDay. Join us &amp; #LIUB.... https://t.co/tR3hqqyWvv'"
1140,2017-04-03 10:15:17,14,0.5859,848841326183534594,"b'Such amazing reporting on unmasking and the crooked scheme against us by @foxandfriends. ""Spied on before nomination."" The real story.'"
1141,2017-04-03 17:56:55,14,0.5106,848957498040217603,b'Looking forward to hosting our heroes from the Wounded Warrior Project (@WWP) Soldier Ride to the @WhiteHouse on Th... https://t.co/QLC0qFD94x'
1142,2017-04-08 19:00:08,14,0.4926,850785347038576640,"b""The reason you don't generally hit runways is that they are easy and inexpensive to quickly fix (fill in and top)!"""
1143,2017-04-08 14:51:10,14,0.2382,850722694958075905,"b'...goodwill and friendship was formed, but only time will tell on trade.'"
1144,2017-04-02 13:03:43,14,0.1779,848521325480202240,"b'Talks on Repealing and Replacing ObamaCare are, and have been, going on, and will continue until such time as a deal is hopefully struck.'"
1145,2017-04-03 11:21:11,14,0.1759,848857910297980928,b'Did Hillary Clinton ever apologize for receiving the answers to the debate? Just asking!'
1146,2017-04-06 02:12:43,14,0.0,849807049118625792,"b'JOBS, JOBS, JOBS!\nhttps://t.co/XGOQPHywrt https://t.co/B5Qbn6llzE'"
1147,2017-04-04 18:38:13,14,0.0,849330281412792320,b'.@WhiteHouse #CEOTownHall\nhttps://t.co/ADSKuUXf1b https://t.co/XHfQ6zmF2H'
1148,2017-04-04 12:39:16,14,0.0,849239946653290496,b'RT @DRUDGE_REPORT: RICE ORDERED SPY DOCS ON TRUMP? https://t.co/bL2nZRFxk9'
1149,2017-04-03 12:51:01,14,0.0,848880519458717698,"b'.@FoxNews from multiple sources: ""There was electronic surveillance of Trump, and people close to Trump. This is unprecedented."" @FBI'"
1150,2017-04-03 11:16:52,14,0.0,848856822312292354,b'Was the brother of John Podesta paid big money to get the sanctions on Russia lifted? Did Hillary know?'
1151,2017-04-02 13:34:16,14,0.0,848529014667055105,b'The real story turns out to be SURVEILLANCE and LEAKING! Find the leakers.'
1152,2017-04-02 12:56:49,14,-0.7319,848519587675201538,b'Anybody (especially  Fake News media) who thinks that Repeal &amp; Replace of ObamaCare is dead does not know the love and strength in R Party!'
1153,2017-03-26 12:21:58,13,0.9392,845974102619906048,"b'Democrats are smiling in D.C. that the Freedom Caucus, with the help of Club For Growth and Heritage, have saved Planned Parenthood &amp; Ocare!'"
1154,2017-03-30 21:17:30,13,0.9186,847558426557337600,b'Great op-ed from @RepKenBuck. Looks like some in the Freedom Caucus are helping me end #Obamacare. https://t.co/Y2vTnIBTBZ'
1155,2017-03-28 20:57:17,13,0.8567,846828561491202048,b'It was an honor to welcome @GLFOP to the @WhiteHouse today with @VP Pence &amp; Attorney General Sessions. THANK YOU fo... https://t.co/VHzTB4c69h'
1156,2017-03-31 17:28:44,13,0.8439,847863243200753666,"b'Great meeting with a wonderful woman today, former Secretary of State, Condoleezza Rice! #USA https://t.co/ZuriIC3YwG'"
1157,2017-03-31 19:37:00,13,0.802,847895524632129536,"b""'Trump Celebrates American Manufacturing Survey Showing Highest Level of Optimism in 20 Years' ... https://t.co/cVWXOa1MjY"""
1158,2017-03-31 14:35:47,13,0.7351,847819720418111488,"b'It was an honor to welcome the Prime Minister of Denmark, Lars Lkke Rasmussen {@larsloekke} to the @WhiteHouse yes... https://t.co/N1g0TiVnSp'"
1159,2017-04-01 16:50:36,13,0.7269,848216035153121285,"b'Wow, @FoxNews just reporting big news. Source: ""Official behind unmasking is high up. Known Intel official is responsible. Some unmasked....'"
1160,2017-03-30 02:12:09,13,0.7184,847270189171228672,b'Today we honored our true American heroes on the first-ever National Vietnam War Veterans Day.\n#ThankAVeteran... https://t.co/deOHapcV4J'
1161,2017-03-28 02:03:17,13,0.7087,846543183223963649,"b'The Democrats will make a deal with me on healthcare as soon as ObamaCare folds - not long. Do not worry, we are in very  good shape!'"
1162,2017-04-01 22:21:02,13,0.6597,848299191646515202,b'Thank you @JCLayfield -- will get even better as my Administration continues to put #AmericaFirst https://t.co/AQQzmt10x7'
1163,2017-03-29 12:21:02,13,0.636,847061031293779969,b'If the people of our great country could only see how viciously and inaccurately my administration is covered by certain media!'
1164,2017-03-27 01:04:42,13,0.6249,846166053663191040,b'General Kelly is doing a great job at the border. Numbers are way down. Many are not even trying to come in anymore.'
1165,2017-03-28 01:41:15,13,0.6141,846537639167713281,b'The Republican House Freedom Caucus was able to snatch defeat from the jaws of victory. After so many bad years they were ready for a win!'
1166,2017-03-31 18:30:38,13,0.5411,847878820220858369,b'It is an exciting time for our country!\n#WeeklyAddress #ConfirmGorsuch https://t.co/tP4bkvTOBq'
1167,2017-03-28 15:26:23,13,0.4926,846745288735887360,b'The failing @NYTimes would do much better if they were honest! \nhttps://t.co/ATy8R3knS2'
1168,2017-03-28 21:48:40,13,0.481,846841493952319489,b'A NEW ERA IN AMERICAN ENERGY! \n#MadeInTheUSA\nWatch here: https://t.co/EG02Fdlkba https://t.co/XT12jqoIqj'
1169,2017-03-31 21:31:44,13,0.4404,847924397180583937,b'We are going to defend our industry &amp; create a level playing field for the American worker. It is time to put... https://t.co/dzPKJMghj1'
1170,2017-03-31 01:43:35,13,0.4404,847625389908217856,b'Only by enlisting the full potential of women in our society will we be truly able to #MakeAmericaGreatAgain... https://t.co/cxhgYaxiek'
1171,2017-03-30 21:20:44,13,0.4404,847559239149158401,"b'If @RepMarkMeadows, @Jim_Jordan and @Raul_Labrador would get on board we would have both great healthcare and massive tax cuts &amp; reform.'"
1172,2017-03-30 21:18:57,13,0.4404,847558790358728705,"b'If @RepMarkMeadows, @Jim_Jordan and Raul_Labrador would get on board we would have both great healthcare and massive tax cuts &amp; reform.'"
1173,2017-03-28 01:35:35,13,0.4199,846536212362018816,"b'...money to Bill, the Hillary Russian ""reset,"" praise of Russia by Hillary, or Podesta Russian Company. Trump Russia story is a hoax. #MAGA!'"
1174,2017-03-29 23:58:11,13,0.3818,847236476815511552,"b"".@FLOTUS Melania and I were honored to stop by the Women's Empowerment  Panel this afternoon at the @WhiteHouse.... https://t.co/phLPw8lgTu"""
1175,2017-03-28 22:41:09,13,0.3724,846854703183020032,"b""Why doesn't Fake News talk about Podesta ties to Russia as covered by @FoxNews or money from Russia to Clinton - sale of  Uranium?"""
1176,2017-04-01 15:35:12,13,0.0,848197060625145856,b'RT @DanScavino: .@POTUS @realDonaldTrump signs executive orders on trade that will set the stage for revival in American manufacturing. #Am...'
1177,2017-03-31 17:45:10,13,0.0,847867380562894848,b'#ConfirmGorsuch #SCOTUS https://t.co/WkqHYMcYa3'
1178,2017-03-30 21:21:50,13,0.0,847559519085379584,"b'Where are @RepMarkMeadows, @Jim_Jordan and @Raul_Labrador?\n#RepealANDReplace #Obamacare'"
1179,2017-03-28 11:16:44,13,0.0,846682464215076866,b'Watch @foxandfriends now on Podesta and Russia!'
1180,2017-03-28 10:36:02,13,0.0,846672219073863681,b'Big announcement by Ford today. Major investment to be made in three Michigan plants. Car companies coming back to U.S.  JOBS! JOBS! JOBS!'
1181,2017-04-01 17:02:29,13,-0.0772,848219027659010051,"b'..not associated with Russia. Trump team spied on before he was nominated."" If this is true, does not get much bigger. Would be sad for U.S.'"
1182,2017-03-30 22:16:50,13,-0.2023,847573358912974849,b'...and job losses. American companies must be prepared to look at other alternatives.'
1183,2017-03-30 13:07:42,13,-0.2714,847435163143454723,"b""The Freedom Caucus will hurt the entire Republican agenda if they don't get on the team, &amp; fast. We must fight them, &amp; Dems, in 2018!"""
1184,2017-04-01 16:06:14,13,-0.34,848204870876356608,"b'...use subsidies to buy health plans."" In other words, Ocare is dead. Good things will happen, however, either with Republicans or Dems.'"
1185,2017-03-28 01:26:04,13,-0.3724,846533818811080704,"b""Why isn't the House Intelligence Committee looking into the Bill &amp; Hillary deal that allowed big Uranium to go to Russia, Russian speech...."""
1186,2017-03-31 11:04:32,13,-0.4199,847766558520856578,"b'Mike Flynn should ask for immunity in that this is a witch hunt (excuse for big election loss), by media &amp; Dems, of historic proportion!'"
1187,2017-03-30 22:16:17,13,-0.6115,847573220417044480,b'The meeting next week with China will be a very difficult one in that we can no longer have massive trade deficits...'
1188,2017-03-29 21:39:01,13,-0.6249,847201455165624320,"b""Today's EO established a commission on combating drug addiction and the opioid crisis. Watch listening session... https://t.co/ooF2ediqSt"""
1189,2017-04-01 15:59:36,13,-0.7717,848203201094483972,"b'The failing @nytimes finally gets it - ""In places where no insurance company offers plans, there will be no way for ObamaCare customers to..'"
1190,2017-03-30 14:27:14,13,-0.8316,847455180912181249,b'The failing @nytimes has disgraced the media world. Gotten me wrong for two solid years. Change libel laws? https://t.co/QIqLgvYLLi'
1191,2017-04-01 12:43:32,13,-0.8374,848153860602507264,b'When will Sleepy Eyes Chuck Todd and @NBCNews start talking about the Obama SURVEILLANCE SCANDAL and stop with the Fake Trump/Russia story?'
1192,2017-04-01 13:02:32,13,-0.8516,848158641056362496,"b'It is the same Fake News Media that said there is ""no path to victory for Trump"" that is now pushing the phony Russia story. A total scam!'"
1193,2017-03-29 12:01:52,13,-0.864,847056211006631936,"b'Remember when the failing @nytimes apologized to its subscribers, right after the election, because their coverage was so wrong. Now worse!'"
1194,2017-03-25 22:37:02,12,0.9385,845766504608120833,b'Thanks you for all of the Trump Rallies today. Amazing support. We will all MAKE AMERICA GREAT AGAIN!'
1195,2017-03-20 17:15:18,12,0.9109,843873596963459072,b'Congratulations Eric &amp; Lara. Very proud and happy for the two of you! https://t.co/s0T3cTQc40'
1196,2017-03-21 02:18:20,12,0.9054,844010257454153729,"b'Thank you Louisville, Kentucky. Together, we will MAKE AMERICA SAFE AND GREAT AGAIN! https://t.co/qGgWEWUvek'"
1197,2017-03-24 17:59:42,12,0.8286,845334323045765121,"b'Today, I was thrilled to announce a commitment of $25 BILLION &amp; 20K AMERICAN JOBS over the next 4 years. THANK YOU... https://t.co/nWJ1hNmzoR'"
1198,2017-03-25 13:29:17,12,0.807,845628655493677056,b'Happy #MedalOfHonorDay to our heroes! https://t.co/juAB1RmMh0 https://t.co/Sw5ea1OwUf'
1199,2017-03-21 18:12:05,12,0.7845,844250273740738562,"b'Today on #NationalAgDay, we honor our great American farmers &amp; ranchers. Their hard work &amp; dedication are ingrained... https://t.co/IpGRhly2zj'"
1200,2017-03-25 14:37:52,12,0.7781,845645916732358656,b'ObamaCare will explode and we will all get together and piece together a great healthcare plan for THE PEOPLE. Do not worry!'
1201,2017-03-21 17:33:23,12,0.7579,844240534562594817,"b""Honored to sign S.442 today. With this legislation, we support @NASA's scientists, engineers, and astronauts in the... https://t.co/Z5VwluvJQx"""
1202,2017-03-23 22:19:43,12,0.7574,845037368386207746,b'It was an honor to welcome so many truckers and trucking industry leaders to the @WhiteHouse today! https://t.co/M1veooVBNE'
1203,2017-03-24 17:03:46,12,0.7184,845320243614547968,"b'Today, I was pleased to announce the official approval of the presidential permit for the #KeystonePipeline. A grea... https://t.co/GWNo2XAueg'"
1204,2017-03-20 13:14:49,12,0.4871,843813078076719107,"b'What about all of the contact with the Clinton campaign and the Russians? Also, is it true that the DNC would not let the FBI in to look?'"
1205,2017-03-24 12:23:00,12,0.4753,845249587178819584,"b'The irony is that the Freedom Caucus, which is very pro-life and against Planned Parenthood, allows P.P. to continue if they stop this plan!'"
1206,2017-03-23 16:07:55,12,0.4574,844943801848414209,b'We are taking action to #RepealANDReplace #Obamacare! Contact your Rep &amp; tell them you support #AHCA. #PassTheBill... https://t.co/5lsrDJXfzb'
1207,2017-03-20 23:03:36,12,0.4199,843961248811225089,"b'Thank you Louisville, Kentucky- on my way! #MAGA https://t.co/3QsBsib6kt'"
1208,2017-03-25 14:41:14,12,0.0,845646761704243200,b'Watch @JudgeJeanine on @FoxNews tonight at 9:00 P.M.'
1209,2017-03-23 01:03:18,12,0.0,844716149828993025,b'RT @mitchellvii: EXACTLY AS I SAID - House Intel Chair: We Cannot Rule Out Sr. Obama Officials Were Involved in Trump Surveillance https://...'
1210,2017-03-21 17:02:31,12,0.0,844232766711648256,b'Joined the @HouseGOP Conference this morning at the U.S. Capitol. https://t.co/03e4YBIWr0 #PassTheBill #MAGA... https://t.co/3swdFWGQtP'
1211,2017-03-20 11:02:57,12,0.0,843779892776964097,"b'The real story that Congress, the FBI and all others should be looking into is the leaking of Classified information. Must find leaker now!'"
1212,2017-03-19 20:20:22,12,0.0,843557782666317826,b'#ICYMI: Weekly Address \nhttps://t.co/ckVx2zgA1x https://t.co/dTGZLvlsGv'
1213,2017-03-22 13:09:35,12,-0.1759,844536536930619393,b'Big day for healthcare. Working hard!'
1214,2017-03-23 01:04:32,12,-0.2332,844716458844311553,"b""RT @mitchellvii: Trump always ends up being right.  It's almost a little freaky."""
1215,2017-03-24 12:14:32,12,-0.2942,845247455868391425,"b'After seven horrible years of ObamaCare (skyrocketing premiums &amp; deductibles, bad healthcare), this is finally your chance for a great plan!'"
1216,2017-03-23 01:33:54,12,-0.4779,844723847094026242,b'Spoke to U.K. Prime Minister Theresa May today to offer condolences on the terrorist attack in London. She is strong and doing very well.'
1217,2017-03-20 10:49:48,12,-0.5255,843776582825267201,b'The Democrats made up and pushed the Russian story as an excuse for running a terrible campaign. Big advantage in Electoral College &amp; lost!'
1218,2017-03-23 15:16:24,12,-0.5859,844930836663357440,"b'A great American, Kurt Cochran, was killed in the London terror attack. My prayers and condolences are with his family and friends.'"
1219,2017-03-23 12:18:33,12,-0.7226,844886082663698436,b'Just watched the totally biased and fake news reports of the so-called Russia story on NBC and ABC. Such dishonesty!'
1220,2017-03-20 10:35:28,12,-0.745,843772976151642112,b'James Clapper and others stated that there is no evidence Potus colluded with Russia. This story is FAKE NEWS and everyone knows it!'
1221,2017-03-20 12:35:14,12,-0.802,843803115044454402,b'Just heard Fake News CNN is doing polls again despite the fact that their election polls were a WAY OFF disaster. Much higher ratings at Fox'
1222,2017-03-17 12:12:04,11,0.9041,842710123852320770,b'Happy La Fheile Phadraig to all of my great Irish friends!'
1223,2017-03-14 16:12:22,11,0.8955,841683431398469632,b'Great optimism in America  and the results will be even better! https://t.co/SYBl47CsZn'
1224,2017-03-16 21:54:02,11,0.8588,842494190990901248,b'Great progress on healthcare. Improvements being made - Republicans coming together!'
1225,2017-03-15 11:29:05,11,0.8268,841974528683192320,"b'Looking forward to a big rally in Nashville, Tennessee, tonight. Big crowd of great people expected. Will be fun!'"
1226,2017-03-13 20:57:02,11,0.7906,841392683625172992,b'Proud to welcome our great Cabinet this afternoon for our first meeting. Unfortunately 4 seats were empty because S... https://t.co/bMYph832hF'
1227,2017-03-16 22:43:32,11,0.7901,842506649122279425,b'My representatives had a great meeting w/ the Hispanic Chamber of Commerce at the WH today. Look forward to tremendous growth &amp; future mtgs!'
1228,2017-03-18 13:23:37,11,0.7866,843090516283723776,"b'...vast sums of money to NATO &amp; the United States must be paid more for the powerful, and very expensive, defense it provides to Germany!'"
1229,2017-03-16 00:03:23,11,0.7519,842164356297175040,"b'In Nashville, Tennessee! Lets MAKE AMERICA GREAT AGAIN! https://t.co/m5UR4vv6UH'"
1230,2017-03-16 20:09:38,11,0.7351,842467917639913472,"b'An honor to welcome the Taoiseach of Ireland, @EndaKennyTD to the @WhiteHouse today with @VP Pence.  https://t.co/J3iTl2iSiQ'"
1231,2017-03-13 12:52:29,11,0.7269,841270741060464648,"b'It is amazing how rude much of the media is to my very hard working representatives. Be nice, you will do much better!'"
1232,2017-03-17 15:39:10,11,0.6588,842762240184999936,b'Great meeting with the @RepublicanStudy Committee this morning at the @WhiteHouse! https://t.co/8Y2UoHoYaY'
1233,2017-03-17 12:30:25,11,0.6124,842714739365105664,b'RT @foxandfriends: VIDEO: Rep. Scalise  GOP agrees on over 85 percent of health care bill https://t.co/05dtfjAUbx'
1234,2017-03-15 20:55:52,11,0.5411,842117164144431104,b'I will be interviewed by @TuckerCarlson tonight at 9:00 P.M. on @FoxNews. Enjoy!'
1235,2017-03-17 14:07:26,11,0.5106,842739155230740481,"b'""The President Changed. So Has Small Businesses\' Confidence""\nhttps://t.co/daTGjPmYeJ'"
1236,2017-03-16 21:43:07,11,0.5106,842491443675611138,b'RT @USHCC: USHCC was delighted to host @IvankaTrump for a roundtable discussion w/ Hispanic women biz owners today in Washington #USHCCLegi...'
1237,2017-03-16 04:20:41,11,0.4199,842229104434913280,"b'Thank you Nashville, Tennessee! https://t.co/6snvQ0DzXN'"
1238,2017-03-15 23:25:25,11,0.4199,842154802058543105,b'Thank you Andrew Jackson! #POTUS7 #USA https://t.co/GToWsWXiNv'
1239,2017-03-15 12:14:20,11,0.3788,841985915778142209,"b""CEO's most optimistic since 2009. It will only get better as we continue to slash unnecessary regulations and when we begin our big tax cut!"""
1240,2017-03-17 12:34:17,11,0.368,842715710765830147,"b'RT @foxandfriends: FOX NEWS ALERT: Jihadis using religious visa to enter US, experts warn (via @FoxFriendsFirst) https://t.co/pwXeR9OMQC'"
1241,2017-03-17 12:26:12,11,0.296,842713677174358016,b'RT @AmericaFirstPol: MAJOR IMPACT: @POTUS Trump is 50 Days in and moving swiftly to get America back on the right track. #MAGA \nhttps://t.c...'
1242,2017-03-16 15:52:22,11,0.296,842403173742579714,b'A budget that puts #AmericaFirst must make safety its no. 1 prioritywithout safety there can be no prosperity: https://t.co/9lxx1iQo7m'
1243,2017-03-17 13:07:15,11,0.2779,842724011234791424,"b'North Korea is behaving very badly. They have been ""playing"" the United States for years. China has done little to help!'"
1244,2017-03-18 13:15:41,11,0.25,843088518339612673,"b'Despite what you have heard from the FAKE NEWS, I had a GREAT meeting with German Chancellor Angela Merkel. Nevertheless, Germany owes.....'"
1245,2017-03-17 12:20:22,11,0.25,842712210896052225,b'RT @FoxNews: Jobs created in February. https://t.co/sOaMDxxTA8'
1246,2017-03-15 11:13:58,11,0.0,841970726341074945,"b'Will be going to Detroit, Michigan (love), today for a big meeting on bringing back car production to State &amp; U.S. Already happening!'"
1247,2017-03-14 15:00:25,11,0.0,841665325682827265,"b'JOBS, JOBS, JOBS! https://t.co/wAkQMKdPXA'"
1248,2017-03-13 22:54:16,11,0.0,841422186573369345,"b'Meeting w/ Washington, D.C. @MayorBowser and Metro GM Paul Wiedefeld about incoming winter storm preparations here... https://t.co/mg0A4Hq3bD'"
1249,2017-03-13 17:20:15,11,0.0,841338126316511233,b'Healthcare listening session w/ @VP &amp; @SecPriceMD. Watch: https://t.co/5ayQ4dr8Ip #ReadTheBill:... https://t.co/1cQI0ZBUv8'
1250,2017-03-12 12:36:59,11,0.0,840904454836781056,"b'RT @AmericaFirstPol: .@POTUS Trump led a historic journey to the White House. 50 days in, that historic journey continues. Take a look  ht...'"
1251,2017-03-15 10:55:30,11,-0.628,841966077005463553,"b'Does anybody really believe that a reporter, who nobody ever heard of, ""went to his mailbox"" and found my tax returns? @NBCNews  FAKE NEWS!'"
1252,2017-03-17 09:35:58,11,-0.7263,842670836905639936,"b'RT @DiamondandSilk: When the President says ""You\'re Fired""     That means: ""Pack Yo Stuff and Go, Not Say ""You Refuse to Go!  #DrainTheSwam...'"
1253,2017-03-13 13:11:17,11,-0.7424,841275470796738560,"b'ObamaCare is imploding. It is a disaster and 2017 will be the worst year yet, by far! Republicans will come together and save the day.'"
1254,2017-03-15 11:02:40,11,-0.9168,841967881516679168,"b'Can you imagine what the outcry would be if @SnoopDogg, failing career and all, had aimed and fired the gun at President Obama? Jail time!'"
1255,2017-03-05 17:30:11,10,0.9286,838441522546769923,b'Thank you for the great rallies all across the country. Tremendous support. Make America Great Again!'
1256,2017-03-09 17:01:17,10,0.8516,839883804315684864,"b'Despite what you hear in the press, healthcare is coming along great. We are talking to many groups and it will end in a beautiful picture!'"
1257,2017-03-08 00:14:30,10,0.8398,839268048313929729,b'I feel sure that my friend @RandPaul will come along with the new and great health care program because he knows Obamacare is a disaster!'
1258,2017-03-07 14:14:03,10,0.8171,839116941956640768,"b""Don't let the FAKE NEWS tell you that there is big infighting in the Trump Admin. We are getting along great, and getting major things done!"""
1259,2017-03-10 13:45:02,10,0.7034,840196801009451009,"b'RT @DRUDGE_REPORT: GREAT AGAIN:  +235,000 https://t.co/GkockGNdtC'"
1260,2017-03-06 23:49:53,10,0.6696,838899465390018560,"b""There is an incredible spirit of optimism sweeping the country right nowwe're bringing back the JOBS! https://t.co/BNSLvKiEVj"""
1261,2017-03-08 23:54:16,10,0.6588,839625347524096000,"b'Great news. We are only just beginning. Together, we are going to #MAGA! https://t.co/BSp685Q9Qf https://t.co/K7yeBZsf6r'"
1262,2017-03-08 23:50:25,10,0.6588,839624377826230272,b'Met with @RepCummings today at the @WhiteHouse. Great discussion!'
1263,2017-03-08 11:12:39,10,0.6486,839433678275153921,b'I have tremendous respect for women and the many roles they serve that are vital to the fabric of our society and our economy.'
1264,2017-03-11 14:39:07,10,0.6239,840572799202783233,b'We are making great progress with healthcare. ObamaCare is imploding and will only get worse. Republicans coming together to get job done!'
1265,2017-03-07 13:41:58,10,0.6131,839108868584124417,"b""Don't worry, getting rid of state lines, which will promote competition, will be in phase 2 &amp; 3 of healthcare rollout. @foxandfriends"""
1266,2017-03-07 03:50:49,10,0.6114,838960097674002432,"b'Thank you to @exxonmobil for your $20 billion investment that is creating more than 45,000 manufacturing &amp; construction jobs in the USA!'"
1267,2017-03-09 23:11:27,10,0.5859,839976956703748096,b'Honored to meet this years @SenateYouth delegates w/ @VP Pence in the East Room of the @WhiteHouse. Congratulations... https://t.co/oQIx7LybCV'
1268,2017-03-06 21:22:15,10,0.5707,838862312685637640,"b'45,000 construction &amp; manufacturing jobs in the U.S. Gulf Coast region. $20 billion investment. We are already winning again, America!'"
