,created_date,week,sentiment.compound,id,text-encoded
576,2017-05-08 14:43:35,19,0.0,861592420043157504,"Ask Sally Yates, under oath, if she knows how classified information got into the newspapers soon after she explained it to W.H. Counsel."
577,2017-05-08 12:14:21,19,0.0,861554864542941185,"Ask Sally Yates, under oath, if she knows how classified information got into the newspapers soon after she explained it to W.H. Council."
578,2017-05-08 11:23:05,19,0.0,861541965464207360,"RT @IsraeliPM: PM Benjamin Netanyahu at  weekly Cabinet meeting:
In two weeks, Israel will host @POTUS Trump on his first trip as President..."
579,2017-05-10 12:39:59,19,-0.0258,862286091759611905,"caught, he cried like a baby and begged for forgiveness...and now he is judge &amp; jury. He should be the one who is investigated for his acts."
580,2017-05-08 22:46:00,19,-0.2732,861713823505494016,"The Russia-Trump collusion story is a total hoax, when will this taxpayer funded charade end?"
581,2017-05-12 11:51:56,19,-0.3182,862998775731818496,"Again, the story that there was collusion between the Russians &amp; Trump campaign was fabricated by Dems as an excuse for losing the election."
582,2017-05-10 12:57:16,19,-0.4767,862290442129461249,The Roger Stone report on @CNN is false - Fake News. Have not spoken to Roger in a long time - had nothing to do with my decision.
583,2017-05-08 22:43:39,19,-0.5249,861713233786404864,Sally Yates made the fake media extremely unhappy today --- she said nothing but old news!
584,2017-05-12 11:53:48,19,-0.5255,862999243560288256,The Fake Media is working overtime today!
585,2017-05-07 11:37:35,19,-0.5562,861183225082806272,RT @brunelldonald: I thought about jobs that went overseas failing schools open borders not my skin color when I voted @realDonaldTrump! I...
586,2017-05-07 22:58:47,19,-0.5574,861354654856249344,Rexnord of Indiana made a deal during the Obama Administration to move to Mexico. Fired their employees. Tax product big that's sold in U.S.
587,2017-05-12 12:54:54,19,-0.5719,863014620516233216,"When James Clapper himself, and virtually everyone else with knowledge of the witch hunt, says there is no collusion, when does it end?"
588,2017-05-07 11:15:26,19,-0.5812,861177649179373569,When will the Fake Media ask about the Dems dealings with Russia &amp; why the DNC wouldn't allow the FBI to check their server or investigate?
589,2017-05-07 11:17:59,19,-0.5904,861178291671244800,"RT @FoxNews: .@POTUS: ""I'm not against the media. I'm against the FAKE media."" #CashinIn https://t.co/F7mBIj7iVL"
590,2017-05-10 11:28:38,19,-0.6037,862268135944192000,RT @DRUDGE_REPORT: 10 SCANDALS ON DIRECTOR'S WATCH... https://t.co/dnGY08wTBP
591,2017-05-08 22:41:12,19,-0.6486,861712617299210240,"Director Clapper reiterated what everybody, including the fake media already knows- there is ""no evidence"" of collusion w/ Russia and Trump."
592,2017-05-07 12:49:39,19,-0.7081,861201362834665472,Republican Senators will not let the American people down! ObamaCare premiums and deductibles are way up - it was a lie and it is dead!
593,2017-05-10 02:42:52,19,-0.7444,862135824745467905,"Cryin' Chuck Schumer stated recently, ""I do not have confidence in him (James Comey) any longer."" Then acts so indignant.  #draintheswamp"
594,2017-05-08 11:57:42,19,-0.7542,861550676505219073,General Flynn was given the highest security clearance by the Obama Administration - but the Fake News seldom likes talking about that.
595,2017-05-11 00:14:58,19,-0.7644,862460991451344896,"The Democrats should be ashamed. This is a disgrace!
#DrainTheSwamp https://t.co/UfbKEECm2V"
596,2017-05-10 19:23:52,19,-0.7798,862387734492663808,Dems have been complaining for months &amp; months about Dir. Comey. Now that he has been fired they PRETEND to be aggrieved. Phony hypocrites!
597,2017-05-10 11:10:48,19,-0.819,862263649821503489,"The Democrats have said some of the worst things about James Comey, including the fact that he should be fired, but now they play so sad!"
598,2017-04-30 12:05:31,18,0.954,858653541094879232,Big excitement last night in the Great State of Pennsylvania! Fantastic crowd and people. MAKE AMERICA GREAT AGAIN!
599,2017-05-05 12:52:36,18,0.9421,860477328882905089,"Big win in the House - very exciting! But when everything comes together with the inclusion of Phase 2, we will have truly great healthcare!"
600,2017-05-05 02:55:02,18,0.919,860326946147840001,It was a GREAT day for the United States of America! This is a great plan that is a repeal &amp; replace of ObamaCare.... https://t.co/0TnmLn55Lm
601,2017-05-02 21:08:14,18,0.908,859514893418082310,"Congratulations to the winners of the Commander-in-Chief's Trophy, the great Air Force Falcons! 
Watch:... https://t.co/HyxxFCfaUh"
602,2017-05-03 22:01:42,18,0.8402,859890737160302592,An honor to host President Mahmoud Abbas at the WH today. Hopefully something terrific could come out it between th... https://t.co/eyHLFZbKhn
603,2017-05-05 06:16:06,18,0.8126,860377543878348800,"An honor to welcome PM of Australia, @TurnbullMalcolm to America &amp; join him in marking the 75th Anniversary of the... https://t.co/foMUec7EAE"
604,2017-05-04 15:26:00,18,0.7269,860153543151542272,"Beautiful evening with Religious Leaders here at the WH last night. Join us now for a #NationalDayofPrayer, LIVE:... https://t.co/b8j1tWZJuv"
605,2017-05-01 20:30:42,18,0.7096,859143061678501892,"#ICYMI- On Saturday I signed two EO's to help keep jobs &amp; wealth in our country.
EO1: https://t.co/XJggnJAiPi 
EO2:... https://t.co/2iEten4SVl"
606,2017-05-04 11:07:35,18,0.6908,860088511202029569,Congratulations to @foxandfriends on its unbelievable ratings hike.
607,2017-05-05 23:34:36,18,0.6588,860638890570416132,Great jobs report today - It is all beginning to work!
608,2017-04-30 11:33:12,18,0.6588,858645405252374528,I will be interviewed on @FaceTheNation this morning at 10:00 A.M. Have a great day!
609,2017-05-03 02:51:07,18,0.6476,859601184285491201,FBI Director Comey was the best thing that ever happened to Hillary Clinton in that he gave her a free pass for many bad deeds! The phony...
610,2017-05-04 18:07:29,18,0.636,860194183797243904,"If victorious, Republicans will be having a big press conference at the beautiful Rose Garden of the White House immediately after vote!"
611,2017-05-01 19:29:41,18,0.5719,859127705366921216,This month we celebrate the contributions of Asian Americans &amp; Pacific Islanders that enrich our Nation. https://t.co/rEJi9ahOaY
612,2017-05-04 11:09:26,18,0.5267,860088977277235201,"RT @foxandfriends: President Trump to sign an executive order on religious liberty today, the National Day of Prayer | @kevincorke https://..."
613,2017-05-04 10:49:10,18,0.4926,860083874893897728,...allegations of unmasking Trump transition officials. Not good!
614,2017-05-05 19:13:54,18,0.4574,860573284462669824,Of course the Australians have better healthcare than we do --everybody does. ObamaCare is dead! But our healthcare will soon be great.
615,2017-05-03 03:06:16,18,0.4215,859604996236742656,...Trump/Russia story was an excuse used by the Democrats as justification for losing the election. Perhaps Trump just ran a great campaign?
616,2017-05-06 22:39:42,18,0.3876,860987464114110465,"The reason I am staying in Bedminster, N. J., a beautiful community, is that staying in NYC is much more expensive and disruptive. Meetings!"
617,2017-04-30 12:32:50,18,0.3164,858660413873025024,...healthcare plan is on its way. Will have much lower premiums &amp; deductibles while at the same time taking care of pre-existing conditions!
618,2017-04-30 12:09:04,18,0.2575,858654431956672512,"The Democrats, without a leader, have become the party of obstruction.They are only interested in themselves and not in what's best for U.S."
619,2017-05-03 20:57:56,18,0.25,859874689442775045,It was an honor to stop by a #SchoolChoice event hosted by @VP Pence and @usedgov Secretary @BetsyDeVosED at the... https://t.co/B8VxVsYNHA
620,2017-05-02 13:07:10,18,0.1759,859393829505552385,"either elect more Republican Senators in 2018 or change the rules now to 51%. Our country needs a good ""shutdown"" in September to fix mess!"
621,2017-05-05 19:43:37,18,0.0,860580764944969728,#WeeklyAddress https://t.co/4qckKpbtCR
622,2017-05-05 19:32:08,18,0.0,860577873060651008,"JOBS, JOBS, JOBS! https://t.co/UR0eetSEnO"
623,2017-05-04 17:43:11,18,0.0,860188065758838785,"I am watching the Democrats trying to defend the ""you can keep you doctor, you can keep your plan &amp; premiums will go down"" ObamaCare lie."""
624,2017-05-02 13:01:41,18,0.0,859392449181093888,The reason for the plan negotiated between the Republicans and Democrats is that we need 60 votes in the Senate which are not there! We....
625,2017-05-04 10:40:33,18,-0.0772,860081707315232771,"Susan Rice, the former National Security Advisor to President Obama, is refusing to testify before a Senate Subcommittee next week on....."
626,2017-05-04 17:56:51,18,-0.4003,860191508619722752,Insurance companies are fleeing ObamaCare - it is dead. Our healthcare plan will lower premiums &amp; deductibles - and be great healthcare!
627,2017-05-05 13:02:46,18,-0.4199,860479885566980096,"Rather than causing a big disruption in N.Y.C., I will be working out of my home in Bedminster, N.J. this weekend. Also saves country money!"
628,2017-05-05 23:22:22,18,-0.6114,860635815277453313,"Wow,the Fake News media did everything in its power to make the Republican Healthcare victory look as bad as possible.Far better than Ocare!"
629,2017-04-30 12:28:04,18,-0.6124,858659215451271168,You can't compare anything to ObamaCare because ObamaCare is dead. Dems want billions to go to Insurance Companies to bail out donors....New
630,2017-05-04 11:02:54,18,-0.6707,860087334519414784,The Fake News media is officially out of control. They will do or say anything in order to get attention - never been a time like this!
631,2017-05-04 12:28:39,18,-0.784,860108914624532480,"Death spiral!
'Aetna will exit Obamacare markets in VA in 2018, citing expected losses on INDV plans this year'
https://t.co/5YnzDitF8r"
632,2017-05-05 23:29:45,18,-0.8268,860637673744195584,Why is it that the Fake News rarely reports Ocare is on its last legs and that insurance companies are fleeing for their lives? It's dead!
633,2017-05-02 00:55:54,18,-0.902,859209801175269376,"President Andrew Jackson, who died 16 years before the Civil War started, saw it coming and was angry. Would never have let it happen!"
634,2017-04-26 22:27:29,17,0.9477,857360510534209536,"A great great honor to welcome &amp; recognize the National Teacher of the Year, as well as the Teacher of the Year fro... https://t.co/pUGl7RDoVX"
635,2017-04-29 17:39:48,17,0.9041,858375278686613504,"Mainstream (FAKE) media refuses to state our long list of achievements, including 28 legislative signings, strong borders &amp; great optimism!"
636,2017-04-28 12:15:59,17,0.807,857931397562085376,"We are making tremendous progress with the V. A. There has never been so much done so quickly, and we have just started. We love our VETS!"
637,2017-04-27 18:59:31,17,0.7783,857670562478518273,.@FLOTUS Melania and I were honored to welcome Argentina President @MauricioMacri and First Lady Juliana Awada to t... https://t.co/gR3EPznu1H
638,2017-04-29 15:35:26,17,0.7574,858343980823703553,"Looking forward to RALLY in the Great State of Pennsylvania tonight at 7:30. Big crowd, big energy!"
639,2017-04-29 02:40:11,17,0.7263,858148882756325379,".@LouDobbs just stated that ""President Trump's successes are unmatched in recent presidential history""  Thank you Lou!"
640,2017-04-26 14:53:26,17,0.6932,857246245672366081,"HAPPY BIRTHDAY to our @FLOTUS, Melania! 
https://t.co/rYYp51mxDQ https://t.co/np7KYHglSv"
641,2017-04-27 14:39:04,17,0.6597,857605018266062848,Democrats used to support border security  now they want illegals to pour through our borders.
642,2017-04-27 14:37:30,17,0.6476,857604623531749376,I promise to rebuild our military and secure our border. Democrats want to shut down the government. Politics!
643,2017-04-25 11:23:08,17,0.636,856830933709750272,Proud of @IvankaTrump for her leadership on these important issues. Looking forward to hearing her speak at the W20! https://t.co/e6Uajrm8zp
644,2017-04-28 22:31:25,17,0.5411,858086278037950464,I will be interviewed by @MarthaMaccallum on @FoxNews tonight at 7pm. Enjoy!
645,2017-04-23 14:07:52,17,0.5267,856147612952612864,"Thank you Lake Worth, Florida. @foxandfriends"
646,2017-04-23 19:55:04,17,0.5106,856234989591121922,...popular vote. ABC News/Washington Post Poll (wrong big on election) said almost all stand by their vote on me &amp; 53% said strong leader.
647,2017-04-25 12:36:28,17,0.4685,856849388026687492,"Don't let the fake media tell you that I have changed my position on the WALL. It will get built and help stop drugs, human trafficking etc."
648,2017-04-23 14:05:07,17,0.4576,856146924705120256,Very interesting election currently taking place in France.
649,2017-04-27 22:43:19,17,0.4215,857726884045496325,"Today, I signed an Executive Order on Improving Accountability and Whistleblower Protection at the @DeptVetAffairs:... https://t.co/UQ6VNCyhlj"
650,2017-04-27 14:38:14,17,0.4215,857604808676708353,Democrats jeopardizing the safety of our troops to bail out their donors from insurance companies. It is time to put #AmericaFirst
651,2017-04-25 17:51:03,17,0.4215,856928555179143168,"Remarks at the United States Holocaust Memorial Museum's National Days of Remembrance. 
Full remarks:... https://t.co/BJbI6ZtGo7"
652,2017-04-25 23:32:13,17,0.3612,857014413081137154,"'Presidential Executive Order on Promoting Agriculture and Rural Prosperity in America'
Executive Order:... https://t.co/LVMjZ9Ax0U"
653,2017-04-24 17:11:31,17,0.3595,856556220911681539,Join me in congratulating @NASA's @AstroPeggy by using the hashtag #CongratsPeggy! Earlier today:... https://t.co/AUdJgxXiT4
654,2017-04-27 14:37:51,17,0.3513,857604709829529601,What's more important? Rebuilding our military - or bailing out insurance companies? Ask the Democrats.
655,2017-04-27 14:37:09,17,0.1027,857604537003200512,I want to help our miners while the Democrats are blocking their healthcare.
656,2017-04-29 17:42:34,17,0.0,858375971019399169,"RT @charliekirk11: 100 days ago a new message, leader, &amp; movement took the Oval Office! A government FOR the people BY the people. This is..."
657,2017-04-29 02:34:33,17,0.0,858147464846729217,RT @foxnation: . @TuckerCarlson : #Dems Don't Really Believe #Trump Is a Pawn of #Russia - That's Just Their Political Tool  https://t.co/K...
658,2017-04-27 11:12:12,17,0.0,857552956836786177,I received calls from the President of Mexico and the Prime Minister of Canada asking to renegotiate NAFTA rather than terminate. I agreed..
659,2017-04-26 20:49:16,17,0.0,857335793261568000,"Today, I signed an Executive Order on Enforcing Statutory Prohibitions on Federal Control of Education. EO:... https://t.co/YYafFQncbC"
660,2017-04-26 18:10:04,17,0.0,857295731929034753,"Today, I signed an Executive Order @ the U.S. Dept. of @Interior: 'Review of Designations Under the Antiquities Act... https://t.co/Eq6JDzMqTY"
661,2017-04-26 10:30:54,17,0.0,857180178736459776,"Out of our very big country, with many choices, does everyone notice that both the ""ban"" case and now the ""sanctuary"" case is brought in ..."
662,2017-04-24 20:32:08,17,0.0,856606707463725057,"Today, I signed the Holocaust Remembrance Proclamation: https://t.co/762SqgdLMV #ICYMI- My statement last night at... https://t.co/vrqqFDi8En"
663,2017-04-24 15:31:57,17,0.0,856531163799859201,"....the wall is not built, which it will be, the drug situation will NEVER be fixed the way it should be!
#BuildTheWall"
664,2017-04-24 14:02:01,17,0.0,856508531087990785,#CongratsPeggy! https://t.co/e1q36nKT8g
665,2017-04-27 11:21:20,17,-0.3244,857555256003227648,"...subject to the fact that if we do not reach a fair deal for all, we will then terminate NAFTA. Relationships are good-deal very possible!"
666,2017-04-24 17:18:32,17,-0.3382,856557986474491904,"If our healthcare plan is approved, you will see real healthcare and premiums will start tumbling down. ObamaCare is in a death spiral!"
667,2017-04-26 10:20:00,17,-0.4199,857177434210304001,First the Ninth Circuit rules against the ban &amp; now it hits again on sanctuary cities-both ridiculous rulings. See you in the Supreme Court!
668,2017-04-27 21:42:47,17,-0.4215,857711651952500737,"Presidential Memorandum for the @CommerceGov, @SecretaryRoss re: Aluminum Imports and Threats to National Security:... https://t.co/GnKoVz9GTO"
669,2017-04-24 12:15:45,17,-0.4389,856481786938916865,"The two fake news polls released yesterday, ABC &amp; NBC, while containing some very positive info, were totally wrong in General E. Watch!"
670,2017-04-28 12:12:15,17,-0.4404,857930456767111168,"RT @foxandfriends: Former President Obama's $400K Wall Street speech stuns liberal base; Sen. Warren saying she ""was troubled by that"" http..."
671,2017-04-23 14:20:12,17,-0.4588,856150719656755200,ObamaCare is in serious trouble. The Dems need big money to keep it going - otherwise it dies far sooner than anyone would have thought.
672,2017-04-25 12:30:15,17,-0.474,856847826663460865,Canada has made business for our dairy farmers in Wisconsin and other border states very difficult. We will not stand for this. Watch!
673,2017-04-24 12:28:01,17,-0.5572,856484873133060101,The Wall is a very important tool in stopping drugs from pouring into our country and poisoning our youth (and many others)! If
674,2017-04-28 23:26:18,17,-0.6122,858100088253669376,"North Korea disrespected the wishes of China &amp; its highly respected President when it launched, though unsuccessfully, a missile today. Bad!"
675,2017-04-23 19:48:16,17,-0.6201,856233279841849344,New polls out today are very good considering that much of the media is FAKE and almost always negative. Would still beat Hillary in .....
676,2017-04-23 15:44:59,17,-0.631,856172056932700164,"Eventually, but at a later date so we can get started early, Mexico will be paying, in some form, for the badly needed border wall."
677,2017-04-26 10:51:06,17,-0.6361,857185261029126144,The U.S. recorded its slowest economic growth in five years (2016). GDP up only 1.6%. Trade deficits hurt the economy very badly.
678,2017-04-26 10:38:51,17,-0.7088,857182179469774848,"...the Ninth Circuit, which has a terrible record of being overturned (close to 80%). They used to call this ""judge shopping!"" Messy system."
679,2017-04-27 14:39:25,17,-0.7177,857605104417026049,As families prepare for summer vacations in our National Parks - Democrats threaten to close them and shut down the government. Terrible!
680,2017-04-23 15:42:07,17,-0.7364,856171332521820165,The Democrats don't want money from budget going to border wall despite the fact that it will stop drugs and very bad MS 13 gang members.
681,2017-04-27 11:30:20,17,-0.7371,857557522584088576,The Democrats want to shut government if we don't bail out Puerto Rico and give billions to their insurance companies for OCare failure. NO!
682,2017-04-26 23:06:16,17,-0.807,857370270776086528,"Democrats are trying to bail out insurance companies from disastrous #ObamaCare, and Puerto Rico with your tax dollars. Sad!"
683,2017-04-22 19:01:59,16,0.9432,855859245023211520,"Today on Earth Day, we celebrate our beautiful forests, lakes and land. We stand committed to preserving the natural beauty of our nation."
684,2017-04-20 01:34:10,16,0.9098,854870777287634944,A great honor to host the @SuperBowl Champion New England @Patriots at the White House today. Congratulations!... https://t.co/tQ5XEPaIxn
685,2017-04-22 16:05:37,16,0.8832,855814859069558784,Getting ready to visit Walter Reed Medical Center with Melania. Looking forward to seeing our bravest and greatest Americans!
686,2017-04-17 12:13:17,16,0.8271,853944453538750464,"A great book for your reading enjoyment: ""REASONS TO VOTE FOR DEMOCRATS"" by Michael J. Knowles."
687,2017-04-19 04:09:17,16,0.8252,854547423464759296,"Despite major outside money, FAKE media support and eleven Republican candidates, BIG ""R"" win with runoff in Georgia. Glad to be of help!"
688,2017-04-20 21:35:05,16,0.8221,855172998747348998,A great honor to host PM Paolo Gentiloni of Italy at the White House this afternoon! #ICYMI- Joint Press Conference... https://t.co/lJAvEZJV1F
689,2017-04-17 00:45:01,16,0.75,853771244579282944,"The recent Kansas election (Congress) was a really big media event, until the Republicans won. Now they play the same game with Georgia-BAD!"
690,2017-04-22 21:49:10,16,0.7385,855901315305795584,I am committed to keeping our air and water clean but always remember that economic growth enhances environmental protection. Jobs matter!
691,2017-04-18 02:18:38,16,0.69,854157191053553666,"With eleven Republican candidates running in Georgia (on Tuesday) for Congress, a runoff will be a win. Vote ""R"" for lower taxes &amp; safety!"
692,2017-04-21 20:22:14,16,0.6155,855517053238870019,"WELCOME HOME, AYA!
#GodBlessTheUSA https://t.co/CR4I8dvunc"
693,2017-04-16 13:07:11,16,0.6114,853595628655587334,I did what was an almost an impossible thing to do for a Republican-easily won the Electoral College! Now Tax Returns are brought up again?
694,2017-04-16 12:24:49,16,0.6114,853584968047636480,Happy Easter to everyone!
695,2017-04-22 15:18:49,16,0.5994,855803080310390784,RT @foxandfriends: Israeli PM Netanyahu praises U.S. policy changes during meeting with Defense. Sec Mattis https://t.co/v2C9oaq3uY
696,2017-04-17 22:38:30,16,0.5904,854101790886948866,"TRUMP APPROVAL HITS 50%
https://t.co/vjZkGTyQb9"
697,2017-04-17 13:35:27,16,0.5904,853965129024712704,RT @DRUDGE_REPORT: TRUMP APPROVAL HITS 50% https://t.co/TruX3WzR3U
698,2017-04-17 22:41:53,16,0.5848,854102644394254341,"See you tomorrow Wisconsin!

'Trump spurs small-business optimism in Milwaukee area'
https://t.co/JUxhO3oqjO"
699,2017-04-18 09:48:10,16,0.5411,854270321620287490,I will be interviewed on @foxandfriends by @ainsleyearhardt starting at 6:00 A.M. Enjoy!
700,2017-04-22 03:38:00,16,0.4939,855626715707650048,"After 5 SB victories since 2002, it was my honor to give Bob Kraft, Coach Belichick, and the players their first to... https://t.co/UZPKjqoGZY"
701,2017-04-19 20:26:45,16,0.4588,854793411110588418,"Today I signed the Veterans (OUR HEROES) Choice Program Extension &amp; Improvement Act @ the @WhiteHouse. #S544 
Watch... https://t.co/0sMv4sPrmf"
702,2017-04-16 13:41:47,16,0.1759,853604334944354305,"Our military is building and is rapidly becoming stronger than ever before. Frankly, we have no choice!"
703,2017-04-17 13:31:03,16,0.1007,853964023846588420,"The super Liberal Democrat in the Georgia Congressioal race tomorrow wants to protect criminals, allow illegal immigration and raise taxes!"
704,2017-04-22 16:15:01,16,0.0,855817226078879748,Big TAX REFORM AND TAX REDUCTION will be announced next Wednesday.
705,2017-04-22 16:10:26,16,0.0,855816071663812608,Next Saturday night I will be holding a BIG rally in Pennsylvania. Look forward to it!
706,2017-04-22 00:19:58,16,0.0,855576880048738304,"RT @Scavino45: .@POTUS @realDonaldTrump, @IvankaTrump, Jared Kushner, &amp; Dina Powell in the Oval Office today w/ Aya &amp; her brother Basel.
#W..."
707,2017-04-20 19:33:46,16,0.0,855142466034556928,"We're going to use American steel, we're going to use American labor, we are going to come first in all deals. ... https://t.co/QYjWx9K4YY"
708,2017-04-19 17:31:28,16,0.0,854749300114546688,#BuyAmericanHireAmerican https://t.co/JPEXQTVR1E
709,2017-04-18 20:56:16,16,0.0,854438452661809152,"#BuyAmericanHireAmerican
Watchhttps://t.co/AUqYcrgeyn https://t.co/rf9aivVb7g"
710,2017-04-18 20:38:25,16,0.0,854433960566431746,"Just learned that Jon @Ossoff, who is running for Congress in Georgia, doesn't even live in the district. Republicans, get out and vote!"
711,2017-04-16 13:13:26,16,0.0,853597199619543041,Someone should look into who paid for the small organized rallies yesterday. The election is over!
712,2017-04-21 10:11:27,16,-0.0516,855363343607103489,RT @foxandfriends: NYT editor apologizes for misleading tweet about New England Patriots' visit to the White House (via @FoxFriendsFirst) h...
713,2017-04-18 10:46:19,16,-0.1511,854284952539725828,Republicans must get out today and VOTE in Georgia 6. Force runoff and easy win! Dem Ossoff will raise your taxes-very bad on crime &amp; 2nd A.
714,2017-04-17 12:07:16,16,-0.202,853942936337350656,"""The first 90 days of my presidency has exposed the total failure of the last eight years of foreign policy!"" So true. @foxandfriends"
715,2017-04-22 00:43:21,16,-0.3612,855582764418162690,"'Presidential Executive Order on Identifying and Reducing Tax Regulatory Burdens' 
Executive Order:... https://t.co/dpE6hDzlAt"
716,2017-04-22 15:18:11,16,-0.3818,855802920956243969,"RT @foxandfriends: Chicago approves new plan to hide illegal immigrants from the feds, plus give them access to city services https://t.co/..."
717,2017-04-19 12:43:18,16,-0.4199,854676780527079425,Dems failed in Kansas and are now failing in Georgia. Great job Karen Handel! It is now Hollywood vs. Georgia on June 20th.
718,2017-04-16 12:18:40,16,-0.4574,853583417916755968,Why would I call China a currency manipulator when they are working with us on the North Korean problem? We will see what happens!
719,2017-04-21 13:04:19,16,-0.4599,855406847200768000,"China is very much the economic lifeline to North Korea so, while nothing is easy, if they want to solve the North Korean problem, they will"
720,2017-04-20 13:48:14,16,-0.7506,855055509455593472,"Failing @nytimes, which has been calling me wrong for two years, just got caught in a big lie concerning New England Patriots visit to W.H."
721,2017-04-21 10:50:33,16,-0.7777,855373184861962240,"No matter how much I accomplish during the ridiculous standard of the first 100 days, &amp; it has been a lot (including S.C.), media will kill!"
